id,observed_on_string,observed_on,time_observed_at,time_zone,out_of_range,user_id,user_login,created_at,updated_at,quality_grade,license,url,image_url,tag_list,description,id_please,num_identification_agreements,num_identification_disagreements,captive_cultivated,oauth_application_id,place_guess,latitude,longitude,positional_accuracy,geoprivacy,positioning_method,positioning_device,species_guess,scientific_name,common_name,iconic_taxon_name,taxon_id229,10/11/05,10/11/05,,Wellington,FALSE,5,n8agrin,2008-05-16 11:08:48 UTC,2015-02-26 22:09:16 UTC,research,,http://conabio.inaturalist.org/observations/229,http://farm1.staticflickr.com/20/69861682_d3a955e4c8.jpg,,,FALSE,4,0,FALSE,,arthur's pass new zealand,-42.97006327,171.5570892,,,,,Kea,Nestor notabilis,Kea,Aves,189413926,12/12/09,12/12/09,,Auckland,,129,field_daze,2009-12-20 02:29:08 UTC,2014-03-13 01:28:12 UTC,casual,CC-BY,http://conabio.inaturalist.org/observations/3926,,,At the wildlife center,FALSE,0,0,FALSE,,Te Anau New Zealand,-45.35207015,167.730725,,,,,Kea,Nestor notabilis,Kea,Aves,1894115918,"September 19, 2010 13:08",19/09/10,2010-09-19 01:08:00 UTC,Wellington,,1115,jon_sullivan,2011-05-02 00:40:52 UTC,2015-02-26 22:18:22 UTC,research,CC-BY,http://conabio.inaturalist.org/observations/15918,http://farm5.staticflickr.com/4107/5010922466_de33566b93.jpg,,a kea on the bus in Arthur's Pass village,FALSE,3,0,FALSE,,"Arthur's Pass, Canterbury, New Zealand",-42.98001125,171.6308292,,,,,Kea,Nestor notabilis,Kea,Aves,18941191315,24/12/12,24/12/12,,Pacific Time (US & Canada),FALSE,12615,liyingtan,2013-02-04 05:32:07 UTC,2014-10-19 23:25:13 UTC,research,CC-BY-NC,http://conabio.inaturalist.org/observations/191315,http://static.inaturalist.org/photos/245941/medium.jpg?1359955970,,"Narrow and curved brown-grey beak, mostly olive green feathers with some yellow and blue",TRUE,4,0,FALSE,,"Southern Alps, South Island, New Zealand",-43.8102804,169.9835845,363949,,,,Kea,Nestor notabilis,Kea,Aves,18941216391,24/12/12,24/12/12,,Pacific Time (US & Canada),FALSE,12615,liyingtan,2013-03-15 07:00:21 UTC,2014-10-20 00:02:37 UTC,research,CC-BY-NC,http://conabio.inaturalist.org/observations/216391,http://static.inaturalist.org/photos/272965/medium.jpg?1363330830,,,FALSE,1,0,FALSE,,"Southern Alps, South Island, New Zealand",-43.7822936,169.9123951,363949,,,,Kea,Nestor notabilis,Kea,Aves,18941352465,23/11/05,23/11/05,,Pacific Time (US & Canada),FALSE,18222,sullivanribbit,2013-07-31 04:52:45 UTC,2014-10-20 06:20:39 UTC,research,CC-BY,http://conabio.inaturalist.org/observations/352465,http://static.inaturalist.org/photos/439495/medium.jpg?1375246371,,,FALSE,2,0,FALSE,,"Te Anau, South Island, New Zealand",-45.34314712,167.677805,10775,,,,Kea,Nestor notabilis,Kea,Aves,18941417231,4/10/13 14:23,4/10/13,2013-10-04 01:23:38 UTC,Auckland,FALSE,15795,scotty,2013-10-04 07:03:05 UTC,2014-10-20 09:15:38 UTC,research,CC-BY-SA,http://conabio.inaturalist.org/observations/417231,http://farm4.staticflickr.com/3700/10080553745_bf63ce3be9.jpg,,,TRUE,3,0,FALSE,,"Arthur's Pass, Canterbury, New Zealand",-42.88101227,171.4709993,,,,,Kea,Nestor notabilis,Kea,Aves,18941424093,4/10/13 14:23,4/10/13,2013-10-04 04:53:22 UTC,Adelaide,FALSE,23093,missbloom,2013-10-10 10:29:21 UTC,2014-10-20 09:32:23 UTC,research,CC-BY-NC,http://conabio.inaturalist.org/observations/424093,http://farm9.staticflickr.com/8275/10185656514_7eca0b5eb0.jpg,,Not captive against his will. Where did he buy those leg bands? ,TRUE,2,0,FALSE,,Arthurs pass NZ,-43.0059021,171.506125,47978,,,,Nestor notabilis,Nestor notabilis,Kea,Aves,18941444614,13/12/06 11:24,13/12/06,2006-12-13 16:24:55 UTC,Eastern Time (US & Canada),FALSE,3773,anita363,2013-10-31 04:04:16 UTC,2014-10-20 10:23:59 UTC,research,CC-BY-NC-SA,http://conabio.inaturalist.org/observations/444614,http://farm1.staticflickr.com/182/372189275_1afc148fa7.jpg,,"Meet a Kea.  Keas are the world's only alpine parrots.  They are large (body as big as a macaw), very intelligent, very playful, and very bold.  I was thrilled to spot my first one in a tree at one of our roadside scenic overlook stops -- and even more thrilled when it came down for a visit.  Unfortunately they seem to be accustomed to handouts.  They also like to play and explore -- shoelaces, pockets, car weatherstripping --and can be very destructive.  Some of the behavior may be looking for food, but some of it is clearly pure play.  Parrots love things with interesting textures (such as rubber weatherstripping!).

More keas &amp; kea antics tomorrow.  Meanwhile, this is the first one I saw.  This one had something wrong with it's right foot, but it knows how handsome it is anyway.",FALSE,2,0,FALSE,,"Southland, New Zealand",-44.81207509,168.1544625,,,,,Kea,Nestor notabilis,Kea,Aves,18941444615,13/12/06 17:47,13/12/06,2006-12-13 22:47:32 UTC,Eastern Time (US & Canada),FALSE,3773,anita363,2013-10-31 04:04:18 UTC,2015-03-13 01:38:49 UTC,research,CC-BY-NC-SA,http://conabio.inaturalist.org/observations/444615,http://farm1.staticflickr.com/160/374019362_a62fce7c8a.jpg,,"This is the car belonging to [rented by?] the intrepid photographer in <a href=""http://www.flickr.com/photos/anitagould/374018299/"">Ooh, look, a Kea!</a>, waiting for the green light on the inland side of the one-way <a href=""http://www.flickr.com/photos/anitagould/374017077/in/set-72157594482057355/"">Homer Tunnel</a>.  He thought it was great fun when the Kea started exploring his car.  We had to warn him that the bird would shred his weatherstripping, given half a chance.  Sure enough, that's what the bird was after!  The driver put a stop to the proceedings before it did too much damage.

Keas are the world's only alpine parrots, and are found only in the Southern Alps of New Zealand.  They are very large (as you can see), very intelligent, very playful, and very bold.  Unfortunately they seem to be accustomed to handouts.  They also like to play and explore -- shoelaces, pockets, car weatherstripping -- and can be very destructive  Some of the behavior may be looking for food, but some of it is clearly pure play.  Parrots love things with interesting textures -- such as rubber weatherstripping!",FALSE,3,0,FALSE,,"Milford Sound, Southland, New Zealand",-44.82254213,167.9492017,,,,,Kea,Nestor notabilis,Kea,Aves,18941940900,28/04/12,28/04/12,,Auckland,,5302,meurkc,2012-07-16 11:38:38 UTC,2014-10-18 01:01:15 UTC,research,CC-BY,http://conabio.inaturalist.org/observations/940900,http://static.inaturalist.org/photos/1199774/medium.?1413261232,,"Arthurs Pass, above viaduct, c 700m",FALSE,1,0,FALSE,,,-42.86978878,171.651632,10,,,,Kea,Nestor notabilis,Kea,Animalia,18941941045,"December 20, 2002 20:41",20/12/02,2002-12-20 07:41:00 UTC,Auckland,,1115,jon_sullivan,2012-08-02 09:43:52 UTC,2014-10-19 07:03:47 UTC,casual,CC-BY,http://conabio.inaturalist.org/observations/941045,http://farm1.static.flickr.com/22/24777360_f5e9009c4f.jpg,,"Kea (<i>Nestor notabilis</i>), the smart, mischevious native mountain parrot.

Captive animal at Willowbank Wildlife Reserve, Christchurch, Canterbury, New Zealand",FALSE,1,0,TRUE,,"Christchurch, Canterbury, New Zealand",-43.47461584,172.5749266,,,,,Kea,Nestor notabilis,Kea,Animalia,18941941214,"April 10, 2006 12:40",10/04/06,2006-04-10 00:40:00 UTC,Auckland,,1115,jon_sullivan,2012-08-12 23:09:53 UTC,2014-10-26 21:07:37 UTC,research,CC-BY,http://conabio.inaturalist.org/observations/941214,http://farm1.static.flickr.com/55/126900211_30cc533aaa.jpg,,"One of a gang of juvenile kea romping about on the mountain side around the Broken River Skifield. They seemed just as curious about us as we were about them.

(060410#037)",FALSE,1,0,FALSE,,"Canterbury, New Zealand",-43.06494785,171.7408142,,,,,Kea,Nestor notabilis,Kea,Animalia,18941941220,"August 16, 2006 12:58",16/08/06,2006-08-16 00:58:00 UTC,Auckland,,1115,jon_sullivan,2012-08-12 23:09:56 UTC,2014-10-18 01:01:29 UTC,research,CC-BY,http://conabio.inaturalist.org/observations/941220,http://farm3.static.flickr.com/2078/2226529537_578c240cf2.jpg,,"student and kea

Nestor notabilis, kea (Bird, Aves, Psittacidae), New Zealand: Endemic

alpine

Lincoln University BIOS211 field trip

Death Corner lookout carpark
Arthurs Pass
Canterbury
New Zealand",FALSE,1,0,FALSE,,"Otira, West Coast, New Zealand",-42.92612998,171.5175369,,,,,Kea,Nestor notabilis,Kea,Animalia,18941941221,"August 13, 2007 15:51",13/08/07,2007-08-13 03:51:00 UTC,Auckland,,1115,jon_sullivan,2012-08-12 23:09:56 UTC,2014-10-18 01:01:29 UTC,research,CC-BY,http://conabio.inaturalist.org/observations/941221,http://farm3.static.flickr.com/2014/2227420772_f06cbe3250.jpg,,"kea in falling snow

Nestor notabilis, kea (Bird, Aves, Psittacidae), New Zealand: Endemic

alpine

Lincoln University BIOS211 field trip

Dobson Nature Walk
Arthurs Pass
Canterbury
New Zealand",FALSE,1,0,FALSE,,"Arthur's Pass, Canterbury, New Zealand",-42.94431255,171.5810118,,,,,Kea,Nestor notabilis,Kea,Animalia,18941941222,"August 13, 2007 14:41",13/08/07,2007-08-13 02:41:00 UTC,Auckland,,1115,jon_sullivan,2012-08-12 23:09:57 UTC,2014-10-18 01:01:29 UTC,research,CC-BY,http://conabio.inaturalist.org/observations/941222,http://farm3.static.flickr.com/2250/2226625267_de2883346c.jpg,,"three of a group of five juvenile kea in the carpark

Nestor notabilis, kea (Bird, Aves, Psittacidae), New Zealand: Endemic

Lincoln University BIOS211 field trip

visitors' centre carpark
Arthurs Pass
Canterbury
New Zealand",FALSE,1,0,FALSE,,"Arthur's Pass, Canterbury, New Zealand",-42.88957729,171.5009489,,,,,Kea,Nestor notabilis,Kea,Animalia,18941941385,11/08/12,11/08/12,,Auckland,,57530,bensikes,2012-08-17 03:22:54 UTC,2014-10-18 01:01:38 UTC,research,CC-BY,http://conabio.inaturalist.org/observations/941385,http://farm9.static.flickr.com/8307/7799437980_175160db2f.jpg,"adaptation, anthropogenic, skiing, Mt. Hutt, Kea","Apparently these guys hang around Mt. Hutt ski area quite a bit. They perhaps have even increased in numbers (at least in annoying the groundskeepers) in recent years. Old hat to many that frequent Mt. Hutt, but nice to see for us new to the islands. The two in the parking lot were dirty from all the fresh mud. A flock of ~12 took off and were making a ruckus while we were going down the bunny slope!",FALSE,1,0,FALSE,,Mt Hutt,-43.43918843,171.5296911,1508,,,,Kea,Nestor notabilis,Kea,Animalia,18941943550,"September 20, 2009 14:32",20/09/09,2009-09-20 02:32:00 UTC,Auckland,,1115,jon_sullivan,2012-09-03 08:35:53 UTC,2014-10-18 01:02:04 UTC,research,CC-BY,http://conabio.inaturalist.org/observations/943550,http://farm9.staticflickr.com/8320/7919830254_deff93f603.jpg,,"A kea checks out Lisa Couet and the rest of the Ecol202 class along the Dobson Nature Walk, Arthurs Pass National Park.",FALSE,1,0,FALSE,,"Dobson Nature Trail, Arthur's Pass, Canterbury, New Zealand",-42.84793098,171.5118429,,,,,Kea,Nestor notabilis,Kea,Animalia,18941943601,"August 13, 2007 15:45",13/08/07,2007-08-13 03:45:00 UTC,Auckland,,1115,jon_sullivan,2012-09-04 20:05:01 UTC,2014-10-18 01:02:07 UTC,research,CC-BY,http://conabio.inaturalist.org/observations/943601,http://farm9.static.flickr.com/8295/7919768798_6afb22bfea.jpg,alpine,"two kea in falling snow on the pass


Lincoln University BIOS211 field trip
",FALSE,1,0,FALSE,,"Dobson Nature Walk, Arthur's Pass, Canterbury, New Zealand",-42.94435743,171.6640299,,,,,Kea,Nestor notabilis,Kea,Animalia,18941943624,"August 16, 2006 12:49",16/08/06,2006-08-16 00:49:00 UTC,Auckland,,1115,jon_sullivan,2012-09-05 05:24:53 UTC,2014-10-18 01:02:08 UTC,research,CC-BY,http://conabio.inaturalist.org/observations/943624,http://farm9.static.flickr.com/8173/7919741364_1035fbf5db.jpg,,"The alpine parrot likes tourists. Note the yellow at the top of the beak indicative of a juvenile.

Lincoln University BIOS211 field trip
",FALSE,1,0,FALSE,,"Death Corner lookout carpark, Arthurs Pass, West Coast, New Zealand",-42.93979818,171.480132,,,,,Kea,Nestor notabilis,Kea,Animalia,18941943729,9/08/12,9/08/12,,Wellington,,57560,steveattwood,2012-09-06 07:53:34 UTC,2014-10-18 01:02:13 UTC,research,CC-BY,http://conabio.inaturalist.org/observations/943729,http://farm9.static.flickr.com/8435/7757326778_cd6b1dc564.jpg,"Arthurs Pass, Nestor notabilis, Nestor, alpine parrot, parrot, kea","Notorious for their sometimes destructive curiosity, kea are highly intelligent birds and, especially juveniles like this bird, love investigating new things with their razor sharp beak, such as cars! It is this curiosity and willingness to test anything for its edibility which has probably helped it survive in its alpine environment.
A protected species of alpine parrot endemic to New Zealand. 
Found in forested and alpine regions of the South Island. 
Little is known about their population except that it seems to be in decline (c. 5000 birds). 
The Kea was once killed for bounty as it occasionally preyed on livestock, especially sheep. It is now known that only a few kea learn this trick and most kea seen on dead sheep are scavanging an already dead carcass.
It only received full protection in 1986. 
Kea nest in burrows or crevices among the roots of trees. They are regarded as one of the most intelligent birds in the world, and for their insatiable curiosity, both vital to their survival in a harsh mountain environment. Kea can solve logical puzzles, such as pushing and pulling things in a certain order to get to food, and will work together to achieve a certain objective. 
The Kea is a large parrot about 48 cm (19 in) long and weighing about 1 kg (2.2 lb). It has mostly olive-green plumage with a grey beak having a long narrow curved upper beak. The adult has dark-brown irises, and the cere, eyerings, and legs are grey. It has orange feathers on the undersides of its wings. The feathers on the sides of its face are dark olive-brown, feathers on its back and rump are orange-red, and some of the outer wing feathers are dull-blue. It has a short and broad bluish-green tail with a black tip. Feather shafts project at the tip of the tail and the undersides of the inner tail feathers have yellow-orange transverse stripes. The male is about 5% longer than the female, and the male's upper beak is 12â€“14% longer than the female's. Juveniles generally resemble adults, but have yellow eyerings and cere, an orange-yellow lower beak, and grey-yellow legs. Kea range from lowland river valleys and coastal forests of the westcoast up to the alpine regions of the South Island such as Arthur's Pass and Aoraki/Mount Cook National Park, closely associated throughout its range with the southern beech (Nothofagus) forests in the alpine ridge. Apart from occasional vagrants, Kea are not found in the North Island, although fossil evidence suggests a population lived there over 10,000 years ago. The population was estimated at between 1,000 and 5,000 individuals in 1986, contrasting with another estimate of 15,000 birds in 1992. Both estimates depend heavily upon the assumptions made. The Kea's widespread distribution at low density across inaccessible areas prevents accurate estimates. Their notorious urge to explore and manipulate, combined with strong attraction to anything new or different in their environment makes this bird a pest for residents and an attraction for tourists. Called ""the clown of the mountains"", it will investigate backpacks, boots or even cars, often causing damage or flying off with smaller items. People commonly encounter wild Kea at South Island ski areas. The Kea are attracted by the prospect of food scraps. Their curiosity leads them to peck and carry away unguarded items of clothing or to pry apart rubber parts of carsâ€”to the entertainment and annoyance of human observers. They are often described as ""cheeky"". A Kea has even been reported to have made off with a Scottish man's passport while he was visiting Fiordland, and theft of car keys, leaving tourists stranded, is a story that has passed into legend.
Mortality is high among young Kea, with less than 40% surviving their first year. The median lifespan of a wild subadult Kea has been estimated at 5 years, based on the proportion of Kea seen again in successive seasons in Arthur's Pass, and allowing for some emigration to surrounding areas. Around 10% of the local Kea population were expected to be over 20 years of age. The oldest known captive Kea was 50 years old in 2008. At least one observer has reported that the Kea is polygynous, with one male attached to multiple females. The same source noted that there was a surplus of females. Kea are social and live in groups of up to 13 birds. Isolated individuals do badly in captivity but respond well to mirror images. In one study, nest sites occur at a density of 1 per 4.4 kmÂ_. The breeding areas are most commonly in Southern Beech (Nothofagus) forests, located on steep mountain sides. Breeding at heights of 1600 m above sea level and higher, it is one of the few parrot species in the world to regularly spend time above tree line. Nest sites are usually positioned on the ground underneath large beech trees, in rock crevices or dug burrows between roots. They are accessed by tunnels leading back 1 m to 6 m into a larger chamber, which is furnished with lichens, moss, ferns and rotting wood. The laying period starts in July and reaches into January. Two to five white eggs are laid, with an incubation time of around 21 days, and a brooding period of 94 days.  An omnivore, the Kea feeds on more than 40 plant species beetle larva, other birds (including shearwater chicks) and mammals (including sheep and rabbits). It has been observed breaking open shearwater nests to feed on the chicks after hearing the chicks in their nests. The Kea is classed as Nationally Endangered in the New Zealand Threat Classification System and Vulnerable in the IUCN Red List.
",FALSE,2,0,FALSE,,Arthurs Pass Canterbury New Zealad,-42.94660931,171.4692503,,,,,Kea,Nestor notabilis,Kea,Animalia,18941943889,9/06/12,9/06/12,,Auckland,,57573,tommo,2012-09-10 04:14:37 UTC,2014-10-13 02:23:50 UTC,casual,CC-BY,http://conabio.inaturalist.org/observations/943889,http://static.inaturalist.org/photos/1200119/medium.?1413262351,,There's a few kea floating around in the valley. I've watched them in many months over the space of about 10 years. This photo is taken during mid-summer.,FALSE,0,0,FALSE,,Jollie River,-43.79219845,170.2376228,,,,,Kea,Nestor notabilis,Kea,Animalia,18941945030,"June 02, 2012 11:13",2/06/12,2012-06-01 23:13:00 UTC,Wellington,,57560,steveattwood,2012-09-26 08:29:18 UTC,2014-10-18 01:02:55 UTC,research,CC-BY,http://conabio.inaturalist.org/observations/945030,http://farm9.static.flickr.com/8152/7319314530_1bff1b721b.jpg,"Canterbury, Otira, Arthurs Pass, Nestor natabilis, Nestor, alpine parrot, parrot, kea","Kea â€“ Nestor notabilis (family Strigopidae)
A protected rare species of alpine parrot endemic to New Zealand. 
Found in forested and alpine regions of the South Island. 
Little is known about their population except that it seems to be in decline (c. 5000 birds). 
The Kea was once killed for bounty as it occasionally preyed on livestock, especially sheep. It is now known that only a few kea learn this trick and most kea seen on dead sheep are scavanging an already dead carcass.
It only received full protection in 1986. 
Kea nest in burrows or crevices among the roots of trees. They are regarded as one of the most intelligent birds in the world, and for their insatiable curiosity, both vital to their survival in a harsh mountain environment. Kea can solve logical puzzles, such as pushing and pulling things in a certain order to get to food, and will work together to achieve a certain objective. 
The Kea is a large parrot about 48 cm (19 in) long and weighing about 1 kg (2.2 lb). It has mostly olive-green plumage with a grey beak having a long narrow curved upper beak. The adult has dark-brown irises, and the cere, eyerings, and legs are grey. It has orange feathers on the undersides of its wings. The feathers on the sides of its face are dark olive-brown, feathers on its back and rump are orange-red, and some of the outer wing feathers are dull-blue. It has a short and broad bluish-green tail with a black tip. Feather shafts project at the tip of the tail and the undersides of the inner tail feathers have yellow-orange transverse stripes. The male is about 5% longer than the female, and the male's upper beak is 12â€“14% longer than the female's. Juveniles generally resemble adults, but have yellow eyerings and cere, an orange-yellow lower beak, and grey-yellow legs. Kea range from lowland river valleys and coastal forests of the westcoast up to the alpine regions of the South Island such as Arthur's Pass and Aoraki/Mount Cook National Park, closely associated throughout its range with the southern beech (Nothofagus) forests in the alpine ridge. Apart from occasional vagrants, Kea are not found in the North Island, although fossil evidence suggests a population lived there over 10,000 years ago. The population was estimated at between 1,000 and 5,000 individuals in 1986, contrasting with another estimate of 15,000 birds in 1992. Both estimates depend heavily upon the assumptions made. The Kea's widespread distribution at low density across inaccessible areas prevents accurate estimates. Their notorious urge to explore and manipulate, combined with strong attraction to anything new or different in their environment makes this bird a pest for residents and an attraction for tourists. Called &quot;the clown of the mountains&quot;, it will investigate backpacks, boots or even cars, often causing damage or flying off with smaller items. People commonly encounter wild Kea at South Island ski areas. The Kea are attracted by the prospect of food scraps. Their curiosity leads them to peck and carry away unguarded items of clothing or to pry apart rubber parts of carsâ€”to the entertainment and annoyance of human observers. They are often described as &quot;cheeky&quot;. A Kea has even been reported to have made off with a Scottish man's passport while he was visiting Fiordland, and theft of car keys, leaving tourists stranded, is a story that has passed into legend.
Mortality is high among young Kea, with less than 40% surviving their first year. The median lifespan of a wild subadult Kea has been estimated at 5 years, based on the proportion of Kea seen again in successive seasons in Arthur's Pass, and allowing for some emigration to surrounding areas. Around 10% of the local Kea population were expected to be over 20 years of age. The oldest known captive Kea was 50 years old in 2008. At least one observer has reported that the Kea is polygynous, with one male attached to multiple females. The same source noted that there was a surplus of females. Kea are social and live in groups of up to 13 birds. Isolated individuals do badly in captivity but respond well to mirror images. In one study, nest sites occur at a density of 1 per 4.4 kmÂ_. The breeding areas are most commonly in Southern Beech (Nothofagus) forests, located on steep mountain sides. Breeding at heights of 1600 m above sea level and higher, it is one of the few parrot species in the world to regularly spend time above tree line. Nest sites are usually positioned on the ground underneath large beech trees, in rock crevices or dug burrows between roots. They are accessed by tunnels leading back 1 m to 6 m into a larger chamber, which is furnished with lichens, moss, ferns and rotting wood. The laying period starts in July and reaches into January. Two to five white eggs are laid, with an incubation time of around 21 days, and a brooding period of 94 days.  An omnivore, the Kea feeds on more than 40 plant species beetle larva, other birds (including shearwater chicks) and mammals (including sheep and rabbits). It has been observed breaking open shearwater nests to feed on the chicks after hearing the chicks in their nests. The Kea is classed as Nationally Endangered in the New Zealand Threat Classification System and Vulnerable in the IUCN Red List.",FALSE,1,0,FALSE,,"Otira, West Coast, New Zealand",-42.82540525,171.5997113,,,,,Kea,Nestor notabilis,Kea,Animalia,18941945032,"June 02, 2012 11:12",2/06/12,2012-06-01 23:12:00 UTC,Wellington,,57560,steveattwood,2012-09-26 08:29:19 UTC,2014-10-18 01:02:55 UTC,research,CC-BY,http://conabio.inaturalist.org/observations/945032,http://farm8.static.flickr.com/7104/7319310432_0a7a75ac4c.jpg,"Canterbury, Otira, Arthurs Pass, Nestor natabilis, Nestor, alpine parrot, parrot, kea","Kea â€“ Nestor notabilis (family Strigopidae)
A protected rare species of alpine parrot endemic to New Zealand. 
Found in forested and alpine regions of the South Island. 
Little is known about their population except that it seems to be in decline (c. 5000 birds). 
The Kea was once killed for bounty as it occasionally preyed on livestock, especially sheep. It is now known that only a few kea learn this trick and most kea seen on dead sheep are scavanging an already dead carcass.
It only received full protection in 1986. 
Kea nest in burrows or crevices among the roots of trees. They are regarded as one of the most intelligent birds in the world, and for their insatiable curiosity, both vital to their survival in a harsh mountain environment. Kea can solve logical puzzles, such as pushing and pulling things in a certain order to get to food, and will work together to achieve a certain objective. 
The Kea is a large parrot about 48 cm (19 in) long and weighing about 1 kg (2.2 lb). It has mostly olive-green plumage with a grey beak having a long narrow curved upper beak. The adult has dark-brown irises, and the cere, eyerings, and legs are grey. It has orange feathers on the undersides of its wings. The feathers on the sides of its face are dark olive-brown, feathers on its back and rump are orange-red, and some of the outer wing feathers are dull-blue. It has a short and broad bluish-green tail with a black tip. Feather shafts project at the tip of the tail and the undersides of the inner tail feathers have yellow-orange transverse stripes. The male is about 5% longer than the female, and the male's upper beak is 12â€“14% longer than the female's. Juveniles generally resemble adults, but have yellow eyerings and cere, an orange-yellow lower beak, and grey-yellow legs. Kea range from lowland river valleys and coastal forests of the westcoast up to the alpine regions of the South Island such as Arthur's Pass and Aoraki/Mount Cook National Park, closely associated throughout its range with the southern beech (Nothofagus) forests in the alpine ridge. Apart from occasional vagrants, Kea are not found in the North Island, although fossil evidence suggests a population lived there over 10,000 years ago. The population was estimated at between 1,000 and 5,000 individuals in 1986, contrasting with another estimate of 15,000 birds in 1992. Both estimates depend heavily upon the assumptions made. The Kea's widespread distribution at low density across inaccessible areas prevents accurate estimates. Their notorious urge to explore and manipulate, combined with strong attraction to anything new or different in their environment makes this bird a pest for residents and an attraction for tourists. Called &quot;the clown of the mountains&quot;, it will investigate backpacks, boots or even cars, often causing damage or flying off with smaller items. People commonly encounter wild Kea at South Island ski areas. The Kea are attracted by the prospect of food scraps. Their curiosity leads them to peck and carry away unguarded items of clothing or to pry apart rubber parts of carsâ€”to the entertainment and annoyance of human observers. They are often described as &quot;cheeky&quot;. A Kea has even been reported to have made off with a Scottish man's passport while he was visiting Fiordland, and theft of car keys, leaving tourists stranded, is a story that has passed into legend.
Mortality is high among young Kea, with less than 40% surviving their first year. The median lifespan of a wild subadult Kea has been estimated at 5 years, based on the proportion of Kea seen again in successive seasons in Arthur's Pass, and allowing for some emigration to surrounding areas. Around 10% of the local Kea population were expected to be over 20 years of age. The oldest known captive Kea was 50 years old in 2008. At least one observer has reported that the Kea is polygynous, with one male attached to multiple females. The same source noted that there was a surplus of females. Kea are social and live in groups of up to 13 birds. Isolated individuals do badly in captivity but respond well to mirror images. In one study, nest sites occur at a density of 1 per 4.4 kmÂ_. The breeding areas are most commonly in Southern Beech (Nothofagus) forests, located on steep mountain sides. Breeding at heights of 1600 m above sea level and higher, it is one of the few parrot species in the world to regularly spend time above tree line. Nest sites are usually positioned on the ground underneath large beech trees, in rock crevices or dug burrows between roots. They are accessed by tunnels leading back 1 m to 6 m into a larger chamber, which is furnished with lichens, moss, ferns and rotting wood. The laying period starts in July and reaches into January. Two to five white eggs are laid, with an incubation time of around 21 days, and a brooding period of 94 days.  An omnivore, the Kea feeds on more than 40 plant species beetle larva, other birds (including shearwater chicks) and mammals (including sheep and rabbits). It has been observed breaking open shearwater nests to feed on the chicks after hearing the chicks in their nests. The Kea is classed as Nationally Endangered in the New Zealand Threat Classification System and Vulnerable in the IUCN Red List.",FALSE,1,0,FALSE,,"Otira, West Coast, New Zealand",-42.82930908,171.6466997,,,,,Kea,Nestor notabilis,Kea,Animalia,18941945034,"June 02, 2012 11:12",2/06/12,2012-06-01 23:12:00 UTC,Wellington,,57560,steveattwood,2012-09-26 08:29:20 UTC,2014-10-18 01:02:55 UTC,research,CC-BY,http://conabio.inaturalist.org/observations/945034,http://farm8.static.flickr.com/7212/7319308682_beb6ed98de.jpg,"Canterbury, Otira, Arthurs Pass, Nestor natabilis, Nestor, alpine parrot, parrot, kea","Kea â€“ Nestor notabilis (family Strigopidae)
A protected rare species of alpine parrot endemic to New Zealand. 
Found in forested and alpine regions of the South Island. 
Little is known about their population except that it seems to be in decline (c. 5000 birds). 
The Kea was once killed for bounty as it occasionally preyed on livestock, especially sheep. It is now known that only a few kea learn this trick and most kea seen on dead sheep are scavanging an already dead carcass.
It only received full protection in 1986. 
Kea nest in burrows or crevices among the roots of trees. They are regarded as one of the most intelligent birds in the world, and for their insatiable curiosity, both vital to their survival in a harsh mountain environment. Kea can solve logical puzzles, such as pushing and pulling things in a certain order to get to food, and will work together to achieve a certain objective. 
The Kea is a large parrot about 48 cm (19 in) long and weighing about 1 kg (2.2 lb). It has mostly olive-green plumage with a grey beak having a long narrow curved upper beak. The adult has dark-brown irises, and the cere, eyerings, and legs are grey. It has orange feathers on the undersides of its wings. The feathers on the sides of its face are dark olive-brown, feathers on its back and rump are orange-red, and some of the outer wing feathers are dull-blue. It has a short and broad bluish-green tail with a black tip. Feather shafts project at the tip of the tail and the undersides of the inner tail feathers have yellow-orange transverse stripes. The male is about 5% longer than the female, and the male's upper beak is 12â€“14% longer than the female's. Juveniles generally resemble adults, but have yellow eyerings and cere, an orange-yellow lower beak, and grey-yellow legs. Kea range from lowland river valleys and coastal forests of the westcoast up to the alpine regions of the South Island such as Arthur's Pass and Aoraki/Mount Cook National Park, closely associated throughout its range with the southern beech (Nothofagus) forests in the alpine ridge. Apart from occasional vagrants, Kea are not found in the North Island, although fossil evidence suggests a population lived there over 10,000 years ago. The population was estimated at between 1,000 and 5,000 individuals in 1986, contrasting with another estimate of 15,000 birds in 1992. Both estimates depend heavily upon the assumptions made. The Kea's widespread distribution at low density across inaccessible areas prevents accurate estimates. Their notorious urge to explore and manipulate, combined with strong attraction to anything new or different in their environment makes this bird a pest for residents and an attraction for tourists. Called &quot;the clown of the mountains&quot;, it will investigate backpacks, boots or even cars, often causing damage or flying off with smaller items. People commonly encounter wild Kea at South Island ski areas. The Kea are attracted by the prospect of food scraps. Their curiosity leads them to peck and carry away unguarded items of clothing or to pry apart rubber parts of carsâ€”to the entertainment and annoyance of human observers. They are often described as &quot;cheeky&quot;. A Kea has even been reported to have made off with a Scottish man's passport while he was visiting Fiordland, and theft of car keys, leaving tourists stranded, is a story that has passed into legend.
Mortality is high among young Kea, with less than 40% surviving their first year. The median lifespan of a wild subadult Kea has been estimated at 5 years, based on the proportion of Kea seen again in successive seasons in Arthur's Pass, and allowing for some emigration to surrounding areas. Around 10% of the local Kea population were expected to be over 20 years of age. The oldest known captive Kea was 50 years old in 2008. At least one observer has reported that the Kea is polygynous, with one male attached to multiple females. The same source noted that there was a surplus of females. Kea are social and live in groups of up to 13 birds. Isolated individuals do badly in captivity but respond well to mirror images. In one study, nest sites occur at a density of 1 per 4.4 kmÂ_. The breeding areas are most commonly in Southern Beech (Nothofagus) forests, located on steep mountain sides. Breeding at heights of 1600 m above sea level and higher, it is one of the few parrot species in the world to regularly spend time above tree line. Nest sites are usually positioned on the ground underneath large beech trees, in rock crevices or dug burrows between roots. They are accessed by tunnels leading back 1 m to 6 m into a larger chamber, which is furnished with lichens, moss, ferns and rotting wood. The laying period starts in July and reaches into January. Two to five white eggs are laid, with an incubation time of around 21 days, and a brooding period of 94 days.  An omnivore, the Kea feeds on more than 40 plant species beetle larva, other birds (including shearwater chicks) and mammals (including sheep and rabbits). It has been observed breaking open shearwater nests to feed on the chicks after hearing the chicks in their nests. The Kea is classed as Nationally Endangered in the New Zealand Threat Classification System and Vulnerable in the IUCN Red List.",FALSE,1,0,FALSE,,"Otira, West Coast, New Zealand",-42.90205693,171.4435862,,,,,Kea,Nestor notabilis,Kea,Animalia,18941945036,"June 02, 2012 11:10",2/06/12,2012-06-01 23:10:00 UTC,Wellington,,57560,steveattwood,2012-09-26 08:29:21 UTC,2014-10-18 01:02:55 UTC,research,CC-BY,http://conabio.inaturalist.org/observations/945036,http://farm8.static.flickr.com/7082/7319302878_518e74d28c.jpg,"Canterbury, Otira, Arthurs Pass, Nestor natabilis, Nestor, alpine parrot, parrot, kea","Kea â€“ Nestor notabilis (family Strigopidae)
A protected rare species of alpine parrot endemic to New Zealand. 
Found in forested and alpine regions of the South Island. 
Little is known about their population except that it seems to be in decline (c. 5000 birds). 
The Kea was once killed for bounty as it occasionally preyed on livestock, especially sheep. It is now known that only a few kea learn this trick and most kea seen on dead sheep are scavanging an already dead carcass.
It only received full protection in 1986. 
Kea nest in burrows or crevices among the roots of trees. They are regarded as one of the most intelligent birds in the world, and for their insatiable curiosity, both vital to their survival in a harsh mountain environment. Kea can solve logical puzzles, such as pushing and pulling things in a certain order to get to food, and will work together to achieve a certain objective. 
The Kea is a large parrot about 48 cm (19 in) long and weighing about 1 kg (2.2 lb). It has mostly olive-green plumage with a grey beak having a long narrow curved upper beak. The adult has dark-brown irises, and the cere, eyerings, and legs are grey. It has orange feathers on the undersides of its wings. The feathers on the sides of its face are dark olive-brown, feathers on its back and rump are orange-red, and some of the outer wing feathers are dull-blue. It has a short and broad bluish-green tail with a black tip. Feather shafts project at the tip of the tail and the undersides of the inner tail feathers have yellow-orange transverse stripes. The male is about 5% longer than the female, and the male's upper beak is 12â€“14% longer than the female's. Juveniles generally resemble adults, but have yellow eyerings and cere, an orange-yellow lower beak, and grey-yellow legs. Kea range from lowland river valleys and coastal forests of the westcoast up to the alpine regions of the South Island such as Arthur's Pass and Aoraki/Mount Cook National Park, closely associated throughout its range with the southern beech (Nothofagus) forests in the alpine ridge. Apart from occasional vagrants, Kea are not found in the North Island, although fossil evidence suggests a population lived there over 10,000 years ago. The population was estimated at between 1,000 and 5,000 individuals in 1986, contrasting with another estimate of 15,000 birds in 1992. Both estimates depend heavily upon the assumptions made. The Kea's widespread distribution at low density across inaccessible areas prevents accurate estimates. Their notorious urge to explore and manipulate, combined with strong attraction to anything new or different in their environment makes this bird a pest for residents and an attraction for tourists. Called &quot;the clown of the mountains&quot;, it will investigate backpacks, boots or even cars, often causing damage or flying off with smaller items. People commonly encounter wild Kea at South Island ski areas. The Kea are attracted by the prospect of food scraps. Their curiosity leads them to peck and carry away unguarded items of clothing or to pry apart rubber parts of carsâ€”to the entertainment and annoyance of human observers. They are often described as &quot;cheeky&quot;. A Kea has even been reported to have made off with a Scottish man's passport while he was visiting Fiordland, and theft of car keys, leaving tourists stranded, is a story that has passed into legend.
Mortality is high among young Kea, with less than 40% surviving their first year. The median lifespan of a wild subadult Kea has been estimated at 5 years, based on the proportion of Kea seen again in successive seasons in Arthur's Pass, and allowing for some emigration to surrounding areas. Around 10% of the local Kea population were expected to be over 20 years of age. The oldest known captive Kea was 50 years old in 2008. At least one observer has reported that the Kea is polygynous, with one male attached to multiple females. The same source noted that there was a surplus of females. Kea are social and live in groups of up to 13 birds. Isolated individuals do badly in captivity but respond well to mirror images. In one study, nest sites occur at a density of 1 per 4.4 kmÂ_. The breeding areas are most commonly in Southern Beech (Nothofagus) forests, located on steep mountain sides. Breeding at heights of 1600 m above sea level and higher, it is one of the few parrot species in the world to regularly spend time above tree line. Nest sites are usually positioned on the ground underneath large beech trees, in rock crevices or dug burrows between roots. They are accessed by tunnels leading back 1 m to 6 m into a larger chamber, which is furnished with lichens, moss, ferns and rotting wood. The laying period starts in July and reaches into January. Two to five white eggs are laid, with an incubation time of around 21 days, and a brooding period of 94 days.  An omnivore, the Kea feeds on more than 40 plant species beetle larva, other birds (including shearwater chicks) and mammals (including sheep and rabbits). It has been observed breaking open shearwater nests to feed on the chicks after hearing the chicks in their nests. The Kea is classed as Nationally Endangered in the New Zealand Threat Classification System and Vulnerable in the IUCN Red List.",FALSE,1,0,FALSE,,"Otira, West Coast, New Zealand",-42.92411187,171.4768063,,,,,Kea,Nestor notabilis,Kea,Animalia,18941945048,"June 02, 2012 11:14",2/06/12,2012-06-01 23:14:00 UTC,Wellington,,57560,steveattwood,2012-09-26 08:29:28 UTC,2014-10-18 01:02:56 UTC,research,CC-BY,http://conabio.inaturalist.org/observations/945048,http://farm8.static.flickr.com/7100/7319319392_93ef8e40c7.jpg,"Canterbury, Otira, Arthurs Pass, Nestor natabilis, Nestor, alpine parrot, parrot, kea","Kea â€“ Nestor notabilis (family Strigopidae)
A protected rare species of alpine parrot endemic to New Zealand. 
Found in forested and alpine regions of the South Island. 
Little is known about their population except that it seems to be in decline (c. 5000 birds). 
The Kea was once killed for bounty as it occasionally preyed on livestock, especially sheep. It is now known that only a few kea learn this trick and most kea seen on dead sheep are scavanging an already dead carcass.
It only received full protection in 1986. 
Kea nest in burrows or crevices among the roots of trees. They are regarded as one of the most intelligent birds in the world, and for their insatiable curiosity, both vital to their survival in a harsh mountain environment. Kea can solve logical puzzles, such as pushing and pulling things in a certain order to get to food, and will work together to achieve a certain objective. 
The Kea is a large parrot about 48 cm (19 in) long and weighing about 1 kg (2.2 lb). It has mostly olive-green plumage with a grey beak having a long narrow curved upper beak. The adult has dark-brown irises, and the cere, eyerings, and legs are grey. It has orange feathers on the undersides of its wings. The feathers on the sides of its face are dark olive-brown, feathers on its back and rump are orange-red, and some of the outer wing feathers are dull-blue. It has a short and broad bluish-green tail with a black tip. Feather shafts project at the tip of the tail and the undersides of the inner tail feathers have yellow-orange transverse stripes. The male is about 5% longer than the female, and the male's upper beak is 12â€“14% longer than the female's. Juveniles generally resemble adults, but have yellow eyerings and cere, an orange-yellow lower beak, and grey-yellow legs. Kea range from lowland river valleys and coastal forests of the westcoast up to the alpine regions of the South Island such as Arthur's Pass and Aoraki/Mount Cook National Park, closely associated throughout its range with the southern beech (Nothofagus) forests in the alpine ridge. Apart from occasional vagrants, Kea are not found in the North Island, although fossil evidence suggests a population lived there over 10,000 years ago. The population was estimated at between 1,000 and 5,000 individuals in 1986, contrasting with another estimate of 15,000 birds in 1992. Both estimates depend heavily upon the assumptions made. The Kea's widespread distribution at low density across inaccessible areas prevents accurate estimates. Their notorious urge to explore and manipulate, combined with strong attraction to anything new or different in their environment makes this bird a pest for residents and an attraction for tourists. Called &quot;the clown of the mountains&quot;, it will investigate backpacks, boots or even cars, often causing damage or flying off with smaller items. People commonly encounter wild Kea at South Island ski areas. The Kea are attracted by the prospect of food scraps. Their curiosity leads them to peck and carry away unguarded items of clothing or to pry apart rubber parts of carsâ€”to the entertainment and annoyance of human observers. They are often described as &quot;cheeky&quot;. A Kea has even been reported to have made off with a Scottish man's passport while he was visiting Fiordland, and theft of car keys, leaving tourists stranded, is a story that has passed into legend.
Mortality is high among young Kea, with less than 40% surviving their first year. The median lifespan of a wild subadult Kea has been estimated at 5 years, based on the proportion of Kea seen again in successive seasons in Arthur's Pass, and allowing for some emigration to surrounding areas. Around 10% of the local Kea population were expected to be over 20 years of age. The oldest known captive Kea was 50 years old in 2008. At least one observer has reported that the Kea is polygynous, with one male attached to multiple females. The same source noted that there was a surplus of females. Kea are social and live in groups of up to 13 birds. Isolated individuals do badly in captivity but respond well to mirror images. In one study, nest sites occur at a density of 1 per 4.4 kmÂ_. The breeding areas are most commonly in Southern Beech (Nothofagus) forests, located on steep mountain sides. Breeding at heights of 1600 m above sea level and higher, it is one of the few parrot species in the world to regularly spend time above tree line. Nest sites are usually positioned on the ground underneath large beech trees, in rock crevices or dug burrows between roots. They are accessed by tunnels leading back 1 m to 6 m into a larger chamber, which is furnished with lichens, moss, ferns and rotting wood. The laying period starts in July and reaches into January. Two to five white eggs are laid, with an incubation time of around 21 days, and a brooding period of 94 days.  An omnivore, the Kea feeds on more than 40 plant species beetle larva, other birds (including shearwater chicks) and mammals (including sheep and rabbits). It has been observed breaking open shearwater nests to feed on the chicks after hearing the chicks in their nests. The Kea is classed as Nationally Endangered in the New Zealand Threat Classification System and Vulnerable in the IUCN Red List.",FALSE,1,0,FALSE,,"Otira, West Coast, New Zealand",-42.841996,171.5406693,,,,,Kea,Nestor notabilis,Kea,Animalia,18941945745,"October 14, 2012 13:03",14/10/12,2012-10-14 00:03:00 UTC,Wellington,,57560,steveattwood,2012-10-16 06:01:34 UTC,2014-10-18 01:03:26 UTC,research,CC-BY,http://conabio.inaturalist.org/observations/945745,http://farm9.static.flickr.com/8334/8092651410_14f8d18d1a.jpg,"Arthurs Pass, kea, Nestor notabilis, Nestor, parrot, bird","Photographed at Arthur's Pass, South Island, New Zealand.

Kea (family Strigopidae) are a protected rare species of alpine parrot endemic to New Zealand. 
Found in forested and alpine regions of the South Island. 
Little is known about their population except that it seems to be in decline (c. 5000 birds). 
The Kea was once killed for bounty as it occasionally preyed on livestock, especially sheep. It is now known that only a few kea learn this trick and most kea seen on dead sheep are scavanging an already dead carcass.
It only received full protection in 1986. 
Kea nest in burrows or crevices among the roots of trees. They are regarded as one of the most intelligent birds in the world, and for their insatiable curiosity, both vital to their survival in a harsh mountain environment. Kea can solve logical puzzles, such as pushing and pulling things in a certain order to get to food, and will work together to achieve a certain objective. 
The Kea is a large parrot about 48 cm (19 in) long and weighing about 1 kg (2.2 lb). It has mostly olive-green plumage with a grey beak having a long narrow curved upper beak. The adult has dark-brown irises, and the cere, eyerings, and legs are grey. It has orange feathers on the undersides of its wings. The feathers on the sides of its face are dark olive-brown, feathers on its back and rump are orange-red, and some of the outer wing feathers are dull-blue. It has a short and broad bluish-green tail with a black tip. Feather shafts project at the tip of the tail and the undersides of the inner tail feathers have yellow-orange transverse stripes. The male is about 5% longer than the female, and the male's upper beak is 12â€“14% longer than the female's. Juveniles generally resemble adults, but have yellow eyerings and cere, an orange-yellow lower beak, and grey-yellow legs. Kea range from lowland river valleys and coastal forests of the westcoast up to the alpine regions of the South Island such as Arthur's Pass and Aoraki/Mount Cook National Park, closely associated throughout its range with the southern beech (Nothofagus) forests in the alpine ridge. Apart from occasional vagrants, Kea are not found in the North Island, although fossil evidence suggests a population lived there over 10,000 years ago. The population was estimated at between 1,000 and 5,000 individuals in 1986, contrasting with another estimate of 15,000 birds in 1992. Both estimates depend heavily upon the assumptions made. The Kea's widespread distribution at low density across inaccessible areas prevents accurate estimates. Their notorious urge to explore and manipulate, combined with strong attraction to anything new or different in their environment makes this bird a pest for residents and an attraction for tourists. Called &quot;the clown of the mountains&quot;, it will investigate backpacks, boots or even cars, often causing damage or flying off with smaller items. People commonly encounter wild Kea at South Island ski areas. The Kea are attracted by the prospect of food scraps. Their curiosity leads them to peck and carry away unguarded items of clothing or to pry apart rubber parts of carsâ€”to the entertainment and annoyance of human observers. They are often described as &quot;cheeky&quot;. A Kea has even been reported to have made off with a Scottish man's passport while he was visiting Fiordland, and theft of car keys, leaving tourists stranded, is a story that has passed into legend.
Mortality is high among young Kea, with less than 40% surviving their first year. The median lifespan of a wild subadult Kea has been estimated at 5 years, based on the proportion of Kea seen again in successive seasons in Arthur's Pass, and allowing for some emigration to surrounding areas. Around 10% of the local Kea population were expected to be over 20 years of age. The oldest known captive Kea was 50 years old in 2008. At least one observer has reported that the Kea is polygynous, with one male attached to multiple females. The same source noted that there was a surplus of females. Kea are social and live in groups of up to 13 birds. Isolated individuals do badly in captivity but respond well to mirror images. In one study, nest sites occur at a density of 1 per 4.4 kmÂ_. The breeding areas are most commonly in Southern Beech (Nothofagus) forests, located on steep mountain sides. Breeding at heights of 1600 m above sea level and higher, it is one of the few parrot species in the world to regularly spend time above tree line. Nest sites are usually positioned on the ground underneath large beech trees, in rock crevices or dug burrows between roots. They are accessed by tunnels leading back 1 m to 6 m into a larger chamber, which is furnished with lichens, moss, ferns and rotting wood. The laying period starts in July and reaches into January. Two to five white eggs are laid, with an incubation time of around 21 days, and a brooding period of 94 days.  An omnivore, the Kea feeds on more than 40 plant species beetle larva, other birds (including shearwater chicks) and mammals (including sheep and rabbits). It has been observed breaking open shearwater nests to feed on the chicks after hearing the chicks in their nests. The Kea is classed as Nationally Endangered in the New Zealand Threat Classification System and Vulnerable in the IUCN Red List.
",FALSE,1,0,FALSE,,Arthurs Pass New Zealand,-42.96585295,171.6828428,47978,,,google,Kea,Nestor notabilis,Kea,Animalia,18941945746,"October 14, 2012 13:03",14/10/12,2012-10-14 00:03:00 UTC,Wellington,,57560,steveattwood,2012-10-16 06:01:35 UTC,2014-10-18 01:03:26 UTC,research,CC-BY,http://conabio.inaturalist.org/observations/945746,http://farm9.static.flickr.com/8191/8092653896_6c9646e180.jpg,"Arthurs Pass, Nestor notabilis, Nestor, parrot, bird, kea","Photographed at Arthur's Pass, South Island, New Zealand.

Kea (family Strigopidae) are a protected rare species of alpine parrot endemic to New Zealand. 
Found in forested and alpine regions of the South Island. 
Little is known about their population except that it seems to be in decline (c. 5000 birds). 
The Kea was once killed for bounty as it occasionally preyed on livestock, especially sheep. It is now known that only a few kea learn this trick and most kea seen on dead sheep are scavanging an already dead carcass.
It only received full protection in 1986. 
Kea nest in burrows or crevices among the roots of trees. They are regarded as one of the most intelligent birds in the world, and for their insatiable curiosity, both vital to their survival in a harsh mountain environment. Kea can solve logical puzzles, such as pushing and pulling things in a certain order to get to food, and will work together to achieve a certain objective. 
The Kea is a large parrot about 48 cm (19 in) long and weighing about 1 kg (2.2 lb). It has mostly olive-green plumage with a grey beak having a long narrow curved upper beak. The adult has dark-brown irises, and the cere, eyerings, and legs are grey. It has orange feathers on the undersides of its wings. The feathers on the sides of its face are dark olive-brown, feathers on its back and rump are orange-red, and some of the outer wing feathers are dull-blue. It has a short and broad bluish-green tail with a black tip. Feather shafts project at the tip of the tail and the undersides of the inner tail feathers have yellow-orange transverse stripes. The male is about 5% longer than the female, and the male's upper beak is 12â€“14% longer than the female's. Juveniles generally resemble adults, but have yellow eyerings and cere, an orange-yellow lower beak, and grey-yellow legs. Kea range from lowland river valleys and coastal forests of the westcoast up to the alpine regions of the South Island such as Arthur's Pass and Aoraki/Mount Cook National Park, closely associated throughout its range with the southern beech (Nothofagus) forests in the alpine ridge. Apart from occasional vagrants, Kea are not found in the North Island, although fossil evidence suggests a population lived there over 10,000 years ago. The population was estimated at between 1,000 and 5,000 individuals in 1986, contrasting with another estimate of 15,000 birds in 1992. Both estimates depend heavily upon the assumptions made. The Kea's widespread distribution at low density across inaccessible areas prevents accurate estimates. Their notorious urge to explore and manipulate, combined with strong attraction to anything new or different in their environment makes this bird a pest for residents and an attraction for tourists. Called &quot;the clown of the mountains&quot;, it will investigate backpacks, boots or even cars, often causing damage or flying off with smaller items. People commonly encounter wild Kea at South Island ski areas. The Kea are attracted by the prospect of food scraps. Their curiosity leads them to peck and carry away unguarded items of clothing or to pry apart rubber parts of carsâ€”to the entertainment and annoyance of human observers. They are often described as &quot;cheeky&quot;. A Kea has even been reported to have made off with a Scottish man's passport while he was visiting Fiordland, and theft of car keys, leaving tourists stranded, is a story that has passed into legend.
Mortality is high among young Kea, with less than 40% surviving their first year. The median lifespan of a wild subadult Kea has been estimated at 5 years, based on the proportion of Kea seen again in successive seasons in Arthur's Pass, and allowing for some emigration to surrounding areas. Around 10% of the local Kea population were expected to be over 20 years of age. The oldest known captive Kea was 50 years old in 2008. At least one observer has reported that the Kea is polygynous, with one male attached to multiple females. The same source noted that there was a surplus of females. Kea are social and live in groups of up to 13 birds. Isolated individuals do badly in captivity but respond well to mirror images. In one study, nest sites occur at a density of 1 per 4.4 kmÂ_. The breeding areas are most commonly in Southern Beech (Nothofagus) forests, located on steep mountain sides. Breeding at heights of 1600 m above sea level and higher, it is one of the few parrot species in the world to regularly spend time above tree line. Nest sites are usually positioned on the ground underneath large beech trees, in rock crevices or dug burrows between roots. They are accessed by tunnels leading back 1 m to 6 m into a larger chamber, which is furnished with lichens, moss, ferns and rotting wood. The laying period starts in July and reaches into January. Two to five white eggs are laid, with an incubation time of around 21 days, and a brooding period of 94 days.  An omnivore, the Kea feeds on more than 40 plant species beetle larva, other birds (including shearwater chicks) and mammals (including sheep and rabbits). It has been observed breaking open shearwater nests to feed on the chicks after hearing the chicks in their nests. The Kea is classed as Nationally Endangered in the New Zealand Threat Classification System and Vulnerable in the IUCN Red List.
",FALSE,1,0,FALSE,,Arthurs Pass New Zealand,-42.90785679,171.5115239,47978,,,google,Kea,Nestor notabilis,Kea,Animalia,18941945747,"October 14, 2012 13:03",14/10/12,2012-10-14 00:03:00 UTC,Wellington,,57560,steveattwood,2012-10-16 06:01:35 UTC,2014-10-18 01:03:26 UTC,research,CC-BY,http://conabio.inaturalist.org/observations/945747,http://farm9.static.flickr.com/8195/8092656384_341fbc64d2.jpg,"Arthurs Pass, Nestor notabilis, Nestor, parrot, bird, kea","Photographed at Arthur's Pass, South Island, New Zealand.

Kea (family Strigopidae) are a protected rare species of alpine parrot endemic to New Zealand. 
Found in forested and alpine regions of the South Island. 
Little is known about their population except that it seems to be in decline (c. 5000 birds). 
The Kea was once killed for bounty as it occasionally preyed on livestock, especially sheep. It is now known that only a few kea learn this trick and most kea seen on dead sheep are scavanging an already dead carcass.
It only received full protection in 1986. 
Kea nest in burrows or crevices among the roots of trees. They are regarded as one of the most intelligent birds in the world, and for their insatiable curiosity, both vital to their survival in a harsh mountain environment. Kea can solve logical puzzles, such as pushing and pulling things in a certain order to get to food, and will work together to achieve a certain objective. 
The Kea is a large parrot about 48 cm (19 in) long and weighing about 1 kg (2.2 lb). It has mostly olive-green plumage with a grey beak having a long narrow curved upper beak. The adult has dark-brown irises, and the cere, eyerings, and legs are grey. It has orange feathers on the undersides of its wings. The feathers on the sides of its face are dark olive-brown, feathers on its back and rump are orange-red, and some of the outer wing feathers are dull-blue. It has a short and broad bluish-green tail with a black tip. Feather shafts project at the tip of the tail and the undersides of the inner tail feathers have yellow-orange transverse stripes. The male is about 5% longer than the female, and the male's upper beak is 12â€“14% longer than the female's. Juveniles generally resemble adults, but have yellow eyerings and cere, an orange-yellow lower beak, and grey-yellow legs. Kea range from lowland river valleys and coastal forests of the westcoast up to the alpine regions of the South Island such as Arthur's Pass and Aoraki/Mount Cook National Park, closely associated throughout its range with the southern beech (Nothofagus) forests in the alpine ridge. Apart from occasional vagrants, Kea are not found in the North Island, although fossil evidence suggests a population lived there over 10,000 years ago. The population was estimated at between 1,000 and 5,000 individuals in 1986, contrasting with another estimate of 15,000 birds in 1992. Both estimates depend heavily upon the assumptions made. The Kea's widespread distribution at low density across inaccessible areas prevents accurate estimates. Their notorious urge to explore and manipulate, combined with strong attraction to anything new or different in their environment makes this bird a pest for residents and an attraction for tourists. Called &quot;the clown of the mountains&quot;, it will investigate backpacks, boots or even cars, often causing damage or flying off with smaller items. People commonly encounter wild Kea at South Island ski areas. The Kea are attracted by the prospect of food scraps. Their curiosity leads them to peck and carry away unguarded items of clothing or to pry apart rubber parts of carsâ€”to the entertainment and annoyance of human observers. They are often described as &quot;cheeky&quot;. A Kea has even been reported to have made off with a Scottish man's passport while he was visiting Fiordland, and theft of car keys, leaving tourists stranded, is a story that has passed into legend.
Mortality is high among young Kea, with less than 40% surviving their first year. The median lifespan of a wild subadult Kea has been estimated at 5 years, based on the proportion of Kea seen again in successive seasons in Arthur's Pass, and allowing for some emigration to surrounding areas. Around 10% of the local Kea population were expected to be over 20 years of age. The oldest known captive Kea was 50 years old in 2008. At least one observer has reported that the Kea is polygynous, with one male attached to multiple females. The same source noted that there was a surplus of females. Kea are social and live in groups of up to 13 birds. Isolated individuals do badly in captivity but respond well to mirror images. In one study, nest sites occur at a density of 1 per 4.4 kmÂ_. The breeding areas are most commonly in Southern Beech (Nothofagus) forests, located on steep mountain sides. Breeding at heights of 1600 m above sea level and higher, it is one of the few parrot species in the world to regularly spend time above tree line. Nest sites are usually positioned on the ground underneath large beech trees, in rock crevices or dug burrows between roots. They are accessed by tunnels leading back 1 m to 6 m into a larger chamber, which is furnished with lichens, moss, ferns and rotting wood. The laying period starts in July and reaches into January. Two to five white eggs are laid, with an incubation time of around 21 days, and a brooding period of 94 days.  An omnivore, the Kea feeds on more than 40 plant species beetle larva, other birds (including shearwater chicks) and mammals (including sheep and rabbits). It has been observed breaking open shearwater nests to feed on the chicks after hearing the chicks in their nests. The Kea is classed as Nationally Endangered in the New Zealand Threat Classification System and Vulnerable in the IUCN Red List.
",FALSE,1,0,FALSE,,Arthurs Pass New Zealand,-43.01813999,171.5797931,47978,,,google,Kea,Nestor notabilis,Kea,Animalia,18941946734,6/10/12,6/10/12,,Auckland,,57514,jamesmortimer,2012-11-11 07:05:29 UTC,2014-10-18 01:04:21 UTC,research,CC-BY,http://conabio.inaturalist.org/observations/946734,http://static.inaturalist.org/photos/1201095/medium.?1413265207,,,FALSE,1,0,FALSE,,Fox Glacier,-43.55023574,169.9624841,,,,,Kea,Nestor notabilis,Kea,Animalia,18941946985,10/11/12,10/11/12,,Auckland,,57507,murray_dawson,2012-11-12 09:41:42 UTC,2014-10-18 01:04:23 UTC,research,CC-BY,http://conabio.inaturalist.org/observations/946985,http://static.inaturalist.org/photos/1201122/medium.?1413265277,,,FALSE,1,0,FALSE,,"Craigieburn Range, Canterbury",-43.1092844,171.8154464,10,,,,Kea,Nestor notabilis,Kea,Animalia,18941948616,15/12/12,15/12/12,,Auckland,,57735,pimlem,2012-12-18 01:18:54 UTC,2014-10-18 01:06:07 UTC,research,CC-BY,http://conabio.inaturalist.org/observations/948616,http://static.inaturalist.org/photos/1201916/medium.?1413266707,,,FALSE,2,0,FALSE,,,-43.00257772,171.489527,,,,,Kea,Nestor notabilis,Kea,Animalia,18941948974,18/12/12,18/12/12,,Auckland,,57514,jamesmortimer,2013-01-01 08:56:03 UTC,2014-10-13 02:34:51 UTC,casual,CC-BY,http://conabio.inaturalist.org/observations/948974,,,,FALSE,0,0,FALSE,,Fiordland,-45.15415581,167.253781,,,,,Kea,Nestor notabilis,Kea,Animalia,18941948979,19/12/12,19/12/12,,Auckland,,57514,jamesmortimer,2013-01-01 09:09:29 UTC,2014-10-13 02:34:52 UTC,casual,CC-BY,http://conabio.inaturalist.org/observations/948979,,,,FALSE,0,0,FALSE,,Fiordland,-44.97722376,167.7297484,,,,,Kea,Nestor notabilis,Kea,Animalia,18941948995,20/12/12,20/12/12,,Auckland,,57514,jamesmortimer,2013-01-01 09:22:52 UTC,2014-10-13 02:34:54 UTC,casual,CC-BY,http://conabio.inaturalist.org/observations/948995,,,,FALSE,0,0,FALSE,,Fiordland,-45.60726598,167.2235877,,,,,Kea,Nestor notabilis,Kea,Animalia,18941949055,28/01/11,28/01/11,,Auckland,,57650,ian_g,2013-01-02 23:06:26 UTC,2014-10-18 01:06:34 UTC,research,CC-BY,http://conabio.inaturalist.org/observations/949055,http://farm9.static.flickr.com/8494/8340048500_d2f4e5c2dc.jpg,,kea at lookout between Otira Viaduct and the real steep bit of road,FALSE,1,0,FALSE,,,-42.8846396,171.4641095,30,,,,Kea,Nestor notabilis,Kea,Animalia,18941953508,"February 23, 2013 20:56",23/02/13,2013-02-23 07:56:00 UTC,Auckland,,2804,stevepawson,2013-03-02 06:20:20 UTC,2014-10-18 01:09:48 UTC,research,CC-BY,http://conabio.inaturalist.org/observations/953508,http://farm9.static.flickr.com/8239/8519678241_b95d7a9d37.jpg,,,FALSE,1,0,FALSE,,arthurs pass,-42.97546463,171.5700358,,,,manual,Kea,Nestor notabilis,Kea,Animalia,18941954765,9/03/13,9/03/13,,Auckland,,56952,melissa_hutchison,2013-03-11 00:56:41 UTC,2014-10-13 02:46:26 UTC,casual,CC-BY-NC,http://conabio.inaturalist.org/observations/954765,,,,FALSE,0,0,FALSE,,"Mt Cheeseman, Canterbury, New Zealand",-43.20406889,171.7485756,,,,,Kea,Nestor notabilis,Kea,Animalia,18941956069,21/03/13,21/03/13,,Auckland,,56928,zlbc,2013-03-22 19:13:40 UTC,2014-10-13 02:49:25 UTC,casual,,http://conabio.inaturalist.org/observations/956069,,Alpine,Three Keas swooped down for a quick look then disappeared among the high bluffs of Mnt Philistine.,FALSE,0,0,FALSE,,"Upper Otira Valley, Arthurs Pass National Park",-42.91368714,171.5780312,100,,,,Kea,Nestor notabilis,Kea,Animalia,18941958120,1/04/13,1/04/13,,Auckland,,57756,john_barkla,2013-04-03 08:05:37 UTC,2014-10-13 20:22:14 UTC,casual,CC-BY,http://conabio.inaturalist.org/observations/958120,,,Heard calling,FALSE,0,0,FALSE,,"Steele Creek, Greenstone Valley, Otago",-44.91426062,168.2381387,319,,,,Kea,Nestor notabilis,Kea,Animalia,18941959520,13/04/13 16:07,13/04/13,2013-04-13 04:07:50 UTC,Auckland,,1115,jon_sullivan,2013-04-19 09:55:09 UTC,2014-10-18 01:16:41 UTC,research,CC-BY,http://conabio.inaturalist.org/observations/959520,http://farm9.staticflickr.com/8255/8661826105_beb858d5fe.jpg,,"Adult and juvenile kea at the lookout above the viaduct.

We watched one kea glide down to the main road and wait for a car to arrive, jump on its roof, and surf it back up to the carpark, hunched down with its head forward. It all looked well practised. Kea car surfing!",FALSE,1,0,FALSE,,"Devil's Slide lookout, Arthur's Pass National Park, West Coast, New Zealand",-42.87290459,171.5587199,,,,,Kea,Nestor notabilis,Kea,Animalia,18941959744,18/04/13,18/04/13,,Auckland,,57514,jamesmortimer,2013-04-21 09:15:29 UTC,2014-10-13 20:38:03 UTC,casual,CC-BY,http://conabio.inaturalist.org/observations/959744,,,,FALSE,0,0,FALSE,,Foible Stream,-42.49980388,172.1090877,100,,,,Kea,Nestor notabilis,Kea,Animalia,18941960664,25/04/13,25/04/13,,Wellington,,57560,steveattwood,2013-04-26 09:02:18 UTC,2014-10-18 01:17:23 UTC,research,CC-BY,http://conabio.inaturalist.org/observations/960664,http://farm9.staticflickr.com/8523/8682891402_cde8763817.jpg,"Arthurs Pass, Nestor notabilis, Nestor, alpine parrot, parrot, Kea",Kea on the high ridges above Athurs pass highway. ,FALSE,1,0,FALSE,,arthurs pass Canterbury New Zealand,-42.96192694,171.643731,47978,,,,Kea,Nestor notabilis,Kea,Animalia,18941963651,23/03/03 10:01,23/03/03,2003-03-22 22:01:04 UTC,Auckland,,1115,jon_sullivan,2013-05-15 10:43:30 UTC,2014-10-26 21:06:26 UTC,research,CC-BY,http://conabio.inaturalist.org/observations/963651,http://farm8.staticflickr.com/7290/8741173376_25680047b4.jpg,,,FALSE,1,0,FALSE,,"Sudden Valley, Arthur's Pass National Park, Canterbury, New Zealand",-42.96963571,171.7100169,,,,,Kea,Nestor notabilis,Kea,Animalia,18941964297,22/05/91,22/05/91,,Auckland,,1115,jon_sullivan,2013-05-26 00:47:02 UTC,2014-10-18 01:21:51 UTC,research,CC-BY,http://conabio.inaturalist.org/observations/964297,http://farm9.staticflickr.com/8264/8832739926_1da5541787.jpg,,A kea in the beech forest.,FALSE,1,0,FALSE,,"Lyndon Saddle Track, Craigieburn Forest Park, Canterbury, New Zealand",-43.06927366,171.7073904,,,,,Kea,Nestor notabilis,Kea,Animalia,18941965028,1/06/13 14:40,1/06/13,2013-06-01 02:40:39 UTC,Auckland,,1115,jon_sullivan,2013-06-06 11:04:20 UTC,2014-10-19 07:06:48 UTC,casual,CC-BY,http://conabio.inaturalist.org/observations/965028,http://farm4.staticflickr.com/3693/8968409398_3e1dac1b5e.jpg,zoo,There is a healthy and curious (and noisy) group of captive kea at Willowbank.,FALSE,1,0,TRUE,,"Willowbank Reserve, Christchurch, Canterbury, New Zealand",-43.50156216,172.564876,,,,,Kea,Nestor notabilis,Kea,Animalia,18941967679,15/07/13,15/07/13,,Auckland,,56952,melissa_hutchison,2013-07-15 09:56:10 UTC,2015-03-25 21:00:18 UTC,research,CC-BY-NC,http://conabio.inaturalist.org/observations/967679,http://static.inaturalist.org/photos/1220146/medium.?1413310251,,Six kea seen in Arthurs Pass village - 3 jumping on cars at the general store and 3 eating snow with grit in it outside the railway station toilets!,FALSE,1,0,FALSE,,Arthurs Pass village,-42.95863162,171.5945067,300,,,,Kea,Nestor notabilis,Kea,Animalia,18941969691,5/01/06,5/01/06,,Auckland,,57511,p_cochrane,2013-08-18 12:03:32 UTC,2014-10-18 01:27:51 UTC,research,CC-BY,http://conabio.inaturalist.org/observations/969691,http://static.inaturalist.org/photos/1222873/medium.?1413320553,,,FALSE,1,0,FALSE,,,-43.20234239,171.6344824,,,,,Nestor notabilis,Nestor notabilis,Kea,Animalia,18941970762,18/09/09 15:14,18/09/09,2009-09-18 03:14:17 UTC,Auckland,,1115,jon_sullivan,2013-09-03 05:30:34 UTC,2014-10-18 01:29:12 UTC,research,CC-BY,http://conabio.inaturalist.org/observations/970762,http://farm4.staticflickr.com/3734/9658995227_b80526eaed.jpg,,One of a small group of kea sheltering under the eaves of the new public toilet in heavy rain.,FALSE,1,0,FALSE,,"Arthurs Pass Village, Arthur's Pass, Canterbury, New Zealand",-42.89435478,171.5780985,,,,,Kea,Nestor notabilis,Kea,Animalia,18941970913,31/08/13,31/08/13,,Auckland,,57756,john_barkla,2013-09-05 09:27:01 UTC,2014-10-18 01:29:23 UTC,research,CC-BY,http://conabio.inaturalist.org/observations/970913,http://static.inaturalist.org/photos/1224437/medium.?1413323016,"alpine, parrot, bird",In alpine tussockland near Harris Saddle,FALSE,1,0,FALSE,,"Routeburn Valley, Otago",-44.7494148,168.2669274,,,,,Kea,Nestor notabilis,Kea,Animalia,18941972732,"September 23, 2012 02:22",23/09/12,2012-09-22 14:22:00 UTC,Auckland,,57518,mark_parker,2013-09-30 23:33:09 UTC,2014-10-18 01:31:41 UTC,research,CC-BY,http://conabio.inaturalist.org/observations/972732,http://lh3.ggpht.com/-Eh5IeckI6rI/Ukn1H1kKgfI/AAAAAAAAAZw/pT8B5VJanT0/s512/2012-09-22-153.jpg,,,FALSE,1,0,FALSE,,,-43.16318909,171.5498232,,,,,Kea,Nestor notabilis,Kea,Animalia,18941974848,20/10/13,20/10/13,,Auckland,,56952,melissa_hutchison,2013-10-26 02:29:06 UTC,2014-10-13 21:09:08 UTC,casual,CC-BY-NC,http://conabio.inaturalist.org/observations/974848,,,"Heard flying overhead
",FALSE,0,0,FALSE,,"Franz Josef glacier, West Coast",-43.44153335,170.139053,1200,,,,Kea,Nestor notabilis,Kea,Animalia,18941982319,4/01/14 17:02,4/01/14,2014-01-04 04:02:40 UTC,Auckland,,57507,murray_dawson,2014-01-07 11:08:25 UTC,2014-10-18 01:44:11 UTC,research,CC-BY,http://conabio.inaturalist.org/observations/982319,http://farm4.staticflickr.com/3757/11813772803_ac96ebd06e.jpg,,"Nestor notabilis (kea). Ridgeline north of Mt Fyffe, Seaward Kaikoura Range. Â© Murray Dawson",FALSE,1,0,FALSE,,"Canterbury, New Zealand",-42.37008988,173.6080664,,,,,Nestor notabilis,Nestor notabilis,Kea,Animalia,18941983675,10/12/13,10/12/13,,Auckland,,56928,zlbc,2014-01-16 19:11:30 UTC,2014-10-18 01:45:55 UTC,research,,http://conabio.inaturalist.org/observations/983675,http://static.inaturalist.org/photos/1241310/medium.?1413369320,,One of the locals.,FALSE,3,0,FALSE,,Upper Otira Valley,-42.89698698,171.4953887,,,,,Kea,Nestor notabilis,Kea,Animalia,18941983850,6/09/08,6/09/08,,Auckland,,58688,craftycarper,2014-01-19 00:57:54 UTC,2014-10-18 01:46:10 UTC,research,CC-BY,http://conabio.inaturalist.org/observations/983850,http://static.inaturalist.org/photos/1241527/medium.?1413369848,"Porter's Pass, Kea",,FALSE,1,0,FALSE,,Porter's Pass,-43.25509533,171.7462018,,,,,Kea,Nestor notabilis,Kea,Animalia,18941988339,28/02/14,28/02/14,,Wellington,,57560,steveattwood,2014-03-03 10:16:30 UTC,2014-10-18 01:52:07 UTC,research,CC-BY,http://conabio.inaturalist.org/observations/988339,http://farm4.staticflickr.com/3732/12900578895_d5e9865e85.jpg,"Arthur's Pass, alpine parrot, parrot, Nestor notabilis, Kea","This series of shots is a sample from a bigger series showing a group of juvenile kea at the Otira Viaduct Lookout having fun fighting over a 'toy', a piece of bright pink foam, the sort that's used as a protector on things like ski racks, boat trailers etc. The game comprised of one bird grabbing the foam and flying to the top of a bush or rock. The others then had turns at trying to knock the 'king of the rock' off its perch and grabbing the foam, whereas that bird would then take the high ground and the others in turn would try to steal the foam. This game went on for quite some time before an adult bird flew overhead and called the youngsters away.",FALSE,3,0,FALSE,,Arthurs Pass Canterbury New Zealand,-42.87159432,171.6296177,47978,,,,Kea,Nestor notabilis,Kea,Animalia,18941989172,8/03/14,8/03/14,,Auckland,,56690,kale,2014-03-11 09:29:46 UTC,2014-10-18 01:53:13 UTC,research,CC-BY,http://conabio.inaturalist.org/observations/989172,http://static.inaturalist.org/photos/1248375/medium.?1413387671,,,TRUE,2,0,FALSE,,mt cheeseman ski field,-43.20060671,171.7265737,,,,,Kea,Nestor notabilis,Kea,Animalia,18941990693,2/09/12,2/09/12,,Auckland,,56960,sarah_richardson,2014-03-23 07:31:49 UTC,2014-10-18 01:55:02 UTC,research,CC-BY-NC,http://conabio.inaturalist.org/observations/990693,http://static.inaturalist.org/photos/1250123/medium.?1413392917,,On the moraine wall SE of the lake (just by the outlet),FALSE,2,0,FALSE,,,-44.74693439,168.2494697,,,,,Kea,Nestor notabilis,Kea,Animalia,18941990911,19/01/14,19/01/14,,Auckland,,58906,alanah,2014-03-25 02:52:25 UTC,2014-10-18 01:55:21 UTC,research,CC-BY-NC,http://conabio.inaturalist.org/observations/990911,http://static.inaturalist.org/photos/1250409/medium.?1413393763,Arthurs Pass,,FALSE,1,0,FALSE,,,-42.89910329,171.6643992,,,,,Kea,Nestor notabilis,Kea,Animalia,18941992501,31/03/14,31/03/14,,Wellington,,57560,steveattwood,2014-04-03 05:48:29 UTC,2014-10-18 01:57:46 UTC,research,CC-BY,http://conabio.inaturalist.org/observations/992501,http://farm6.staticflickr.com/5502/13576857773_0065a65f4b.jpg,"Arthur's Pass, Otira Valley, alpine parrot, parrot, Nestor notabilis, Kea","This series of shots shows two behaviours of juvenile kea, one feeding naturally on Coprosma berries (in this case, I think, Coprosma rugosa), the other showing the notorious car dismantling behaviour! When I was with DOC I wrote media releases about a study which showed that young kea are the primary vandals and their destructive curiosity can be greatly reduced by preventing access to human food so they have to spend time and energy foraging naturally. I was intrigued that different birds had different techniques for taking the Coprosma berries with some using the lower mandible as a scoop/net to catch berries falling from the branch as they were knocked off by the upper mandible. But other birds delicately picked one berry at a time between the tips of their bill.",FALSE,2,0,FALSE,,Otira Valley New Zealand,-42.95198679,171.6041522,,,,,Kea,Nestor notabilis,Kea,Animalia,18941993223,22/03/14,22/03/14,,Auckland,,58872,ahoover,2014-04-07 10:05:04 UTC,2014-10-19 06:34:39 UTC,research,CC-BY-NC,http://conabio.inaturalist.org/observations/993223,http://static.inaturalist.org/photos/1252603/medium.?1413398154,,There were Kea sitting on the roof of a building near the entrance for Avalanche Peak. They were calling to one another and causing general mischief by picking at cars.,FALSE,2,0,FALSE,,"Arthur's Pass village, Canterbury, New Zealand",-42.94069696,171.5225696,,,,,Kea,Nestor notabilis,Kea,Animalia,18941994480,5/04/14 15:41,5/04/14,2014-04-05 03:41:36 UTC,Auckland,,1115,jon_sullivan,2014-04-10 05:18:03 UTC,2014-10-18 02:00:16 UTC,research,CC-BY,http://conabio.inaturalist.org/observations/994480,http://farm8.staticflickr.com/7059/13750268164_8eb3e72f63.jpg,,A group of juvenile kea were gathered at the lookout at Death's Corner.,FALSE,2,0,FALSE,,"Devil's Slide lookout (Death's corner), Arthur's Pass National Park, West Coast, New Zealand",-42.86088345,171.5861276,,,,,Kea,Nestor notabilis,Kea,Animalia,18941997792,22/03/14,22/03/14,,Auckland,,59006,jeremyc-nz,2014-04-29 00:27:48 UTC,2014-10-13 22:00:24 UTC,casual,CC-BY-NC,http://conabio.inaturalist.org/observations/997792,,,Three Kea flying high seen (and heard!) from track between Cedar Flats Hut and carpark.,FALSE,0,0,FALSE,,Toaroha River,-43.00458223,171.1472754,,,,,Kea,Nestor notabilis,Kea,Animalia,18941997793,20/03/14,20/03/14,,Auckland,,59006,jeremyc-nz,2014-04-29 00:33:37 UTC,2014-10-13 22:00:24 UTC,casual,CC-BY-NC,http://conabio.inaturalist.org/observations/997793,,,One Kea flying high late evening above Crystal Biv in the Toaroha Valley,FALSE,0,0,FALSE,,Toaroha River,-42.95898677,171.2551375,,,,,Kea,Nestor notabilis,Kea,Animalia,18941997796,24/02/14,24/02/14,,Auckland,,59006,jeremyc-nz,2014-04-29 01:52:24 UTC,2014-10-13 22:00:25 UTC,casual,CC-BY-NC,http://conabio.inaturalist.org/observations/997796,,,"Seven Kea flying high at Fox Glacier, seen from glacier lookout, looking up the glacier",FALSE,0,0,FALSE,,fox glacier,-43.55197779,169.9618956,,,,,Kea,Nestor notabilis,Kea,Animalia,18941997797,23/02/14,23/02/14,,Auckland,,59006,jeremyc-nz,2014-04-29 01:57:20 UTC,2014-10-13 22:00:25 UTC,casual,CC-BY-NC,http://conabio.inaturalist.org/observations/997797,,,"Two Juvenile Kea hopping around on the road to Gillespies Beach just before sunset, watched them for about 20 minutes, another one was hanging around in the trees above occasionally calling out.",FALSE,0,0,FALSE,,Gillespies Beach,-43.34577567,169.8498466,,,,,Kea,Nestor notabilis,Kea,Animalia,18941997827,21/04/14,21/04/14,,Auckland,,57756,john_barkla,2014-04-29 08:11:44 UTC,2014-10-13 22:00:28 UTC,casual,CC-BY,http://conabio.inaturalist.org/observations/997827,,"hut, call, parrot, Kea",Hear calling at night from Dynamo hut,FALSE,0,0,FALSE,,"Skippers, Shotover Valley, Otago",-44.72550917,168.6117721,,,,,Kea,Nestor notabilis,Kea,Animalia,18941997835,5/04/14,5/04/14,,Auckland,,58801,charlotte7,2014-04-29 08:46:57 UTC,2014-10-18 02:05:46 UTC,research,CC-BY-NC,http://conabio.inaturalist.org/observations/997835,http://static.inaturalist.org/photos/1257644/medium.?1413406310,"Arthurs Pass, Kea",,FALSE,2,0,FALSE,,otira gorge arthur's pass,-42.77081998,171.6060461,10583,,,,Kea,Nestor notabilis,Kea,Animalia,18941997974,23/12/12,23/12/12,,Auckland,,59006,jeremyc-nz,2014-04-30 01:13:07 UTC,2014-10-13 22:00:44 UTC,casual,CC-BY-NC,http://conabio.inaturalist.org/observations/997974,,,One Kea flying high near Homer Hut on the Milford Road,FALSE,0,0,FALSE,,Homer Tunnel,-44.74235747,168.0088487,,,,,Kea,Nestor notabilis,Kea,Animalia,18941998716,7/04/14,7/04/14,,Auckland,,58845,jundam,2014-05-04 03:13:45 UTC,2015-06-26 09:50:41 UTC,casual,CC-BY-NC,http://conabio.inaturalist.org/observations/998716,,,"There were two Kea standing on the roof of a building, Arthur's pass village is a position where can see Kea easily.",FALSE,0,0,FALSE,,arthur'S pass village,-42.96548521,171.6399622,47978,,,,Kea,Nestor notabilis,Kea,Animalia,18941998823,2/05/14,2/05/14,,Auckland,,58559,gus320,2014-05-05 00:15:55 UTC,2015-01-05 21:27:56 UTC,research,CC-BY-NC-SA,http://conabio.inaturalist.org/observations/998823,http://static.inaturalist.org/photos/1258730/medium.?1413408126,,,FALSE,2,0,FALSE,,Arthurs Pass,-42.87099389,171.6071273,,,,,Kea,Nestor notabilis,Kea,Animalia,18941999405,21/01/12,21/01/12,,Auckland,,57762,janegosden,2014-05-07 10:52:20 UTC,2015-02-22 09:43:47 UTC,research,CC-BY,http://conabio.inaturalist.org/observations/999405,http://static.inaturalist.org/photos/1259268/medium.?1413409093,,At this site we had two adults and their very fresh fledgling. The photo is of one of the parent birds (from memory the female). ,FALSE,2,0,FALSE,,Arthur's Pass,-42.93283489,171.7168679,715,,,manual,Kea,Nestor notabilis,Kea,Animalia,18941999407,31/01/13,31/01/13,,Auckland,,57762,janegosden,2014-05-07 11:14:50 UTC,2015-02-22 09:44:08 UTC,research,CC-BY,http://conabio.inaturalist.org/observations/999407,http://static.inaturalist.org/photos/1259270/medium.?1413409096,,Three fledglings on the Dobson riverbed.,FALSE,2,0,FALSE,,Dobson Valley,-43.94318453,170.0042326,6118,,,,Kea,Nestor notabilis,Kea,Animalia,189411005490,17/02/06,17/02/06,,Auckland,,57588,neil_fitzgerald,2014-06-19 07:47:15 UTC,2015-01-05 21:00:53 UTC,research,CC-BY-NC,http://conabio.inaturalist.org/observations/1005490,http://static.inaturalist.org/photos/1266605/medium.?1413425182,,An oldie of a young one from Mt Arthur,FALSE,1,0,FALSE,,"Mt Arthur, new zealand",-41.18260335,172.6357353,,,,,Kea,Nestor notabilis,Kea,Animalia,189411006616,17/02/14,17/02/14,,Auckland,,58289,tim_hopley,2014-06-28 09:19:42 UTC,2015-01-06 02:20:12 UTC,research,CC-BY-NC,http://conabio.inaturalist.org/observations/1006616,http://static.inaturalist.org/photos/1267692/medium.?1413427421,,Two juveniles from a group of four plus two adult birds.,FALSE,2,0,FALSE,,,-43.45541663,170.3538771,150,,,,Nestor notabilis,Nestor notabilis,Kea,Animalia,189411009337,4/01/12,4/01/12,,Auckland,,58897,chrismorse,2014-07-18 03:12:15 UTC,2015-06-26 09:52:44 UTC,research,CC-BY-NC,http://conabio.inaturalist.org/observations/1009337,http://static.inaturalist.org/photos/1270155/medium.?1413431428,"feeding, alpine, bird",Family group of Keas feeding on Corposma fowerakeri berries & Ranunculus lyallii leaves in Upper Otira River.,FALSE,2,0,FALSE,,"Upper Otira Valley, Arthurs Pass NP.",-42.96690578,171.4691627,50,,,,Kea,Nestor notabilis,Kea,Animalia,189411009808,14/07/14,14/07/14,,Eastern Time (US & Canada),,59183,kilcken,2014-07-23 22:14:12 UTC,2015-06-26 09:40:48 UTC,research,CC-BY-NC,http://conabio.inaturalist.org/observations/1009808,http://static.inaturalist.org/photos/1270610/medium.?1413432036,,stopped for a tea break and 1 kea said hello! ,FALSE,2,0,FALSE,,Arthur's Pass,-42.86535628,171.663978,,,,,Kea,Nestor notabilis,Kea,Animalia,189411011716,13/04/14,13/04/14,,Auckland,,58489,majo00,2014-08-08 20:14:30 UTC,2015-06-26 17:58:15 UTC,research,CC-BY-NC,http://conabio.inaturalist.org/observations/1011716,http://static.inaturalist.org/photos/1272278/medium.?1413435632,Kea,"At the summit came across a group of keas. I was so thrilled! Sorry, the photos aren't very clear. 

On Sat. (6th. April) got to the '1hr to the summit' sign) and heard them, but couldn't see them. It was late arvo and didn't have time to climb to the summit. (I would have run out of daylight) and had to come down. (I accidently deleted all of my photos from my SLR from that day. I almost cried!) Thankfully I still had some photos from the other camera I took along.

Then on this day (Sun. 13th. April) made it all the way to the summit.",FALSE,3,0,FALSE,,"Ben Lomond Summit, Queenstown",-45.04414063,168.646395,,,,,Kea,Nestor notabilis,Kea,Animalia,189411014502,6/09/14,6/09/14,,Auckland,,58897,chrismorse,2014-09-06 05:52:03 UTC,2015-06-26 09:37:05 UTC,casual,CC-BY-NC,http://conabio.inaturalist.org/observations/1014502,,,Calls coming from face for most of the day. Three seen flying from area in late afternoon.,FALSE,0,0,FALSE,,"Kowai River, Porters Pass",-43.21243132,171.7567439,300,,,,Kea,Nestor notabilis,Kea,Animalia,189411016418,6/09/14 17:29,6/09/14,2014-09-06 05:29:00 UTC,Auckland,,57739,gailtv,2014-09-26 07:46:55 UTC,2015-01-05 18:06:26 UTC,research,CC-BY,http://conabio.inaturalist.org/observations/1016418,http://static.inaturalist.org/photos/1277891/medium.?1413446690,,"Cheeky, on the verandah of the Crow Hut in Arthur's Pass.  Happy to explore the mouth feel of my hut-shoes too.",FALSE,2,0,FALSE,,"Crow Hut, Arthurs Pass National Park",-43.02315695,171.567309,,,,,Kea (Nestor notabilis,Nestor notabilis,Kea,Animalia,189411017559,1/10/14,1/10/14,,Auckland,,57805,vegestoc,2014-10-05 18:32:48 UTC,2015-01-05 20:10:09 UTC,research,CC-BY-NC,http://conabio.inaturalist.org/observations/1017559,https://farm3.staticflickr.com/2949/15249587497_2f4912e62d.jpg,,,FALSE,2,0,FALSE,,hommer tunnel,-44.78622211,168.034936,94,,,,Kea,Nestor notabilis,Kea,Animalia,189411033867,12-Sep-14,12/09/14,,Auckland,,60886,shane_orchard,2014-10-14 22:02:24 UTC,2015-06-26 09:37:45 UTC,casual,CC-BY-NC,http://conabio.inaturalist.org/observations/1033867,,,,FALSE,0,0,FALSE,,arthurs pass,-42.90558352,171.6130709,,,,,Kea,Nestor notabilis,Kea,Animalia,189411062046,8/11/14,8/11/14,,Auckland,FALSE,58559,gus320,2014-11-08 11:08:34 UTC,2015-01-05 21:28:04 UTC,research,CC-BY-NC,http://conabio.inaturalist.org/observations/1062046,http://static.inaturalist.org/photos/1331286/medium.jpg?1415444935,,"Cheeky young Kea at the summit of Avalanche Peak, inspecting and attempting to nibble on every unattended piece of trampers' gear.",FALSE,2,0,FALSE,,"Avalanche Peak, Arthur's Pass",-42.93949893,171.5455677,48,,,,Kea,Nestor notabilis,Kea,Aves,189411064354,7/11/14,7/11/14,,Auckland,FALSE,58559,gus320,2014-11-09 11:56:47 UTC,2015-01-05 21:29:22 UTC,research,CC-BY-NC,http://conabio.inaturalist.org/observations/1064354,http://static.inaturalist.org/photos/1334408/medium.jpg?1415534230,,"Juvenile Kea spent quite some time turning over rocks to look for bugs - finally found some small insect. Also ate a leaf or two.  Showed quite a knack for clearing any moss or grass around each 10-15cm stone, as required, then levering up and tipping over the stone to check underneath. Wasn't at all fussed with me squatting next to it observing.",FALSE,3,0,FALSE,,Arthurs Pass,-42.94541135,171.5674396,12,,,,Kea,Nestor notabilis,Kea,Aves,189411069910,17/09/11,17/09/11,,Auckland,FALSE,60886,shane_orchard,2014-11-12 11:19:06 UTC,2015-06-26 09:42:22 UTC,research,,http://conabio.inaturalist.org/observations/1069910,http://static.inaturalist.org/photos/1341132/medium.jpg?1415791606,,,FALSE,4,0,FALSE,,arthurs pass nz,-42.84714888,171.6448544,47978,,,,Kea,Nestor notabilis,Kea,Aves,189411090332,3/11/14 11:18,3/11/14,2014-11-02 22:18:25 UTC,Auckland,FALSE,1,kueda,2014-11-23 23:46:52 UTC,2015-01-05 20:45:32 UTC,research,CC-BY,http://conabio.inaturalist.org/observations/1090332,http://static.inaturalist.org/photos/1370370/medium.jpg?1416786458,,"As we stood outside the car in the hail taking pics of kea sheltered *under* the car, it became clear which species was more intelligent.",FALSE,4,0,FALSE,,"Arthurs Pass, Westland, West Coast, New Zealand",-42.96144385,171.5903075,,,,,Kea,Nestor notabilis,Kea,Aves,189411108766,1/09/14,1/09/14,,Auckland,FALSE,65260,bop12nk,2014-12-03 04:12:20 UTC,2015-01-06 03:00:38 UTC,research,CC-BY-NC,http://conabio.inaturalist.org/observations/1108766,http://static.inaturalist.org/photos/1393855/medium.JPG?1417579969,,,FALSE,4,0,FALSE,,Gunn's Camp,-44.83728227,168.153044,,,,,Kea,Nestor notabilis,Kea,Aves,189411124452,2/12/14,2/12/14,,Auckland,FALSE,60886,shane_orchard,2014-12-10 10:12:58 UTC,2014-12-10 10:13:01 UTC,casual,,http://conabio.inaturalist.org/observations/1124452,http://static.inaturalist.org/photos/1413471/medium.JPG?1418206405,,,FALSE,0,0,FALSE,,,-43.81101254,169.9788666,95,,,,Kea,Nestor notabilis,Kea,Aves,189411124454,13/11/14,13/11/14,,Auckland,FALSE,60886,shane_orchard,2014-12-10 10:18:21 UTC,2014-12-10 10:18:24 UTC,casual,,http://conabio.inaturalist.org/observations/1124454,http://static.inaturalist.org/photos/1413475/medium.JPG?1418206728,,,FALSE,0,0,FALSE,,,-42.90743266,171.7989001,97,,,,Kea,Nestor notabilis,Kea,Aves,189411124464,29/10/14,29/10/14,,Auckland,FALSE,60886,shane_orchard,2014-12-10 10:26:08 UTC,2014-12-10 10:49:02 UTC,research,,http://conabio.inaturalist.org/observations/1124464,http://static.inaturalist.org/photos/1413487/medium.JPG?1418207221,,"flock of 9 feeding in tussock/ herbfield above road, late afternoon

none banded",FALSE,1,0,FALSE,,,-43.1294109,171.665119,48,,,,Kea,Nestor notabilis,Kea,Aves,189411124471,31/08/14,31/08/14,,Auckland,FALSE,60886,shane_orchard,2014-12-10 10:32:44 UTC,2014-12-10 21:33:28 UTC,research,,http://conabio.inaturalist.org/observations/1124471,http://static.inaturalist.org/photos/1413497/medium.JPG?1418207592,,,FALSE,2,0,FALSE,,,-43.00341339,171.4590047,97,,,,kea,Nestor notabilis,Kea,Aves,189411124488,28/08/14,28/08/14,,Auckland,FALSE,60886,shane_orchard,2014-12-10 10:38:05 UTC,2015-04-29 23:23:00 UTC,casual,,http://conabio.inaturalist.org/observations/1124488,http://static.inaturalist.org/photos/1779897/medium.JPG?1430349787,,,FALSE,0,0,FALSE,,new zealand,-42.89135801,171.4776866,97,,,,Kea,Nestor notabilis,Kea,Aves,189411124498,21/08/14,21/08/14,,Auckland,FALSE,60886,shane_orchard,2014-12-10 10:45:15 UTC,2014-12-10 10:45:18 UTC,casual,,http://conabio.inaturalist.org/observations/1124498,http://static.inaturalist.org/photos/1413525/medium.JPG?1418208366,,,FALSE,0,0,FALSE,,new zealand,-44.24177447,168.9050093,1522,,,,Kea,Nestor notabilis,Kea,Aves,189411124501,23/08/14,23/08/14,,Auckland,FALSE,60886,shane_orchard,2014-12-10 10:50:45 UTC,2015-02-22 01:14:30 UTC,casual,,http://conabio.inaturalist.org/observations/1124501,http://static.inaturalist.org/photos/1413528/medium.JPG?1418208674,,lower end of Waterfall Flat,FALSE,0,0,FALSE,,new zealand,-44.30501776,168.9296146,95,,,,kea,Nestor notabilis,Kea,Aves,189411125773,3/11/14 11:19,3/11/14,2014-11-02 22:19:07 UTC,Auckland,FALSE,1115,jon_sullivan,2014-12-11 02:59:56 UTC,2015-01-05 18:13:51 UTC,research,CC-BY,http://conabio.inaturalist.org/observations/1125773,https://farm9.staticflickr.com/8680/15808650537_1870c0527d.jpg,,A banded adult kea sheltered under our car from the driving rain.,FALSE,4,0,FALSE,,"Devil's Slide lookout (Death's corner), Arthur's Pass National Park, Otira, West Coast, New Zealand",-42.82957494,171.5540405,,,,,Kea,Nestor notabilis,Kea,Aves,189411125775,3/11/14 11:19,3/11/14,2014-11-02 22:19:29 UTC,Auckland,FALSE,1115,jon_sullivan,2014-12-11 03:00:00 UTC,2015-06-26 09:35:49 UTC,research,CC-BY,http://conabio.inaturalist.org/observations/1125775,https://farm9.staticflickr.com/8573/15968359656_881bb8e888.jpg,,A juvenile kea sheltered under our car from the driving rain.,FALSE,4,0,FALSE,,"Devil's Slide lookout (Death's corner), Arthur's Pass National Park, Otira, West Coast, New Zealand",-42.90843108,171.5590755,,,,,Kea,Nestor notabilis,Kea,Aves,189411160125,2015-01-04 5:48:19 odp. GMT+13:00,4/01/15,2015-01-04 04:48:19 UTC,Nuku'alofa,FALSE,13187,pavel,2015-01-04 11:06:54 UTC,2015-01-07 11:03:38 UTC,research,CC-BY-NC,http://conabio.inaturalist.org/observations/1160125,http://static.inaturalist.org/photos/1462374/medium.jpg?1420370314,,"2 of them,playing with little rocks,pretty tame",FALSE,1,0,FALSE,2,,-42.91411718,171.4687532,11,,gps,gps,Kea,Nestor notabilis,Kea,Aves,189411161480,29/12/14,29/12/14,,Auckland,FALSE,58459,aunty,2015-01-05 01:09:51 UTC,2015-01-05 18:58:33 UTC,research,CC-BY-NC,http://conabio.inaturalist.org/observations/1161480,http://static.inaturalist.org/photos/1463908/medium.JPG?1420420226,,In the garden next to the train station.,FALSE,3,0,FALSE,,Arthur's Pass village,-42.86571682,171.5289323,47978,,,,Kea,Nestor notabilis,Kea,Aves,189411194705,23/01/15,23/01/15,,Wellington,FALSE,71251,jess_nugteren,2015-01-26 03:18:28 UTC,2015-01-26 11:46:16 UTC,research,CC-BY-NC,http://conabio.inaturalist.org/observations/1194705,http://static.inaturalist.org/photos/1509060/medium.JPG?1422242323,,Kea (Nestor notabilis) flying outside the Arthur's Pass Store,FALSE,3,0,FALSE,,Arthur's Pass,-42.97776645,171.5494186,47978,,,,nestor notabilis,Nestor notabilis,Kea,Aves,189411227663,9/01/15 20:53,9/01/15,2015-01-09 07:53:10 UTC,Auckland,FALSE,2991,sea-kangaroo,2015-02-11 01:22:14 UTC,2015-05-05 18:22:28 UTC,research,CC-BY,http://conabio.inaturalist.org/observations/1227663,http://static.inaturalist.org/photos/1546380/medium.JPG?1423617754,leg band,"Hey!  Turn your back for a second...  

Second photo: that's not food, it's some random trash from the parking lot.  This bird was busy investigating and tearing apart all of it.  

Both of its legs were banded with E.",FALSE,3,0,FALSE,,"Arthur's Pass, Canterbury, New Zealand",-42.70426782,171.6309857,12605,,,,Kea,Nestor notabilis,Kea,Aves,189411239431,17/02/15,17/02/15,,Auckland,TRUE,58591,johnb-nz,2015-02-17 19:32:17 UTC,2015-02-17 19:34:26 UTC,casual,CC-BY-NC,http://conabio.inaturalist.org/observations/1239431,,,Solitary bird flying SW at low altitude.,FALSE,0,0,FALSE,,"Mangarakau, Kahurangi NP, Tasman",-40.60122171,172.4081492,,,,,Kea,Nestor notabilis,Kea,Aves,189411272371,5/03/15,5/03/15,,Auckland,FALSE,57782,timlogan,2015-03-05 09:04:08 UTC,2015-03-05 09:04:08 UTC,casual,CC-BY,http://conabio.inaturalist.org/observations/1272371,,Esk River,A flock of five noisy kea passed over hut.,FALSE,0,0,FALSE,,Lochinvar Hut,-42.90243574,171.9215667,194,,,,Kea,Nestor notabilis,Kea,Aves,189411296714,10/03/15,10/03/15,,Auckland,FALSE,57527,huntj,2015-03-16 07:56:41 UTC,2015-03-16 18:38:34 UTC,research,CC-BY,http://conabio.inaturalist.org/observations/1296714,http://static.inaturalist.org/photos/1626980/medium.jpg?1426492834,,"Kea at Temple Basin ski lodge. They only came to the lodge at sunrise and sunset, making it hard to photograph them.",FALSE,3,0,FALSE,,Temple Basin,-42.90368662,171.579521,,,,,Kea,Nestor notabilis,Kea,Aves,189411307505,16/03/15,16/03/15,,Auckland,FALSE,56960,sarah_richardson,2015-03-21 06:13:20 UTC,2015-03-22 02:39:50 UTC,research,CC-BY-NC,http://conabio.inaturalist.org/observations/1307505,http://static.inaturalist.org/photos/1641506/medium.JPG?1426918416,,Two adults seen several times over the day / night,FALSE,1,0,FALSE,,,-42.60354676,171.7871755,50,,,,Kea,Nestor notabilis,Kea,Aves,189411311179,,,,Auckland,FALSE,81280,felicia_xu,2015-03-22 10:33:50 UTC,2015-03-24 20:01:30 UTC,casual,,http://conabio.inaturalist.org/observations/1311179,http://static.inaturalist.org/photos/1645581/medium.jpg?1427020444,,"Those pictures were taken in 2013. We had a short tour in Milford Sound. When we stopped for looking around, those birds came and stood on the top of cars. They seem unfriendly. 

In general, I described it as a black parrot or a eagle. But I never saw it before. I couldn't remmember if its were sounding. 

We didnt know where were they from. Whether they were wild or not.",FALSE,5,0,FALSE,,milford sound,-44.71217912,167.8144856,773,,,,Kea,Nestor notabilis,Kea,Aves,189411341611,2/02/15,2/02/15,,Auckland,FALSE,57588,neil_fitzgerald,2015-03-26 22:38:00 UTC,2015-03-27 09:31:15 UTC,research,CC-BY-NC,http://conabio.inaturalist.org/observations/1341611,http://static.inaturalist.org/photos/1660225/medium.jpg?1427409504,,"Just a record shot, taken with a 100mm macro. The most seen at one time in this area over the 10 or so days I was there was 5. Most days a couple were heard. Although they twice landed as close as a few m away, they showed little real interest in us. No gear was harmed :)",FALSE,3,0,FALSE,,Basin Creek,-43.17387173,171.4958944,100,,,,Kea,Nestor notabilis,Kea,Aves,189411387660,8/04/15,8/04/15,,Wellington,FALSE,81319,rodcs,2015-04-12 11:09:12 UTC,2015-04-16 21:32:19 UTC,research,,http://conabio.inaturalist.org/observations/1387660,http://static.inaturalist.org/photos/1715164/medium.JPG?1428836979,,Casual observation of 4 Kea birds. They were friendly. ,FALSE,4,0,FALSE,,"Otira Viaduct Lookout, Arthur's Pass",-42.76188064,171.6170507,10583,,,,Kea,Nestor notabilis,Kea,Aves,189411398551,16/04/15,16/04/15,,Auckland,FALSE,58591,johnb-nz,2015-04-16 21:43:43 UTC,2015-04-16 21:43:43 UTC,casual,CC-BY-NC,http://conabio.inaturalist.org/observations/1398551,,,"One bird sighted, but logging contractors on site reported an adult pair with 4 juveniles had been damaging some of their machinery over the past few months. They also reported a pair of falcons were often seen harassing the kea.",FALSE,0,0,FALSE,,"Ligar Bay, Pohara, Tasman",-40.81264927,172.9879274,100,,,,Kea,Nestor notabilis,Kea,Aves,189411435625,17/02/15,17/02/15,,Auckland,FALSE,57762,janegosden,2015-04-29 01:19:22 UTC,2015-04-30 10:26:52 UTC,research,CC-BY,http://conabio.inaturalist.org/observations/1435625,http://static.inaturalist.org/photos/1776418/medium.JPG?1430270455,,,FALSE,3,0,FALSE,,Lake Rototekoiti,-43.62546936,169.6554991,353,,,manual,Kea,Nestor notabilis,Kea,Aves,189411485639,4/05/15,4/05/15,,Auckland,TRUE,58489,majo00,2015-05-13 21:47:17 UTC,2015-05-15 05:57:21 UTC,casual,CC-BY-NC,http://conabio.inaturalist.org/observations/1485639,,Kea,"Actually heard them. But couldn't see them. Small group of them high in the trees on the mountain.

